ORIGIN_AIRPORT_ID,NAME,DEPARTURES_PERFORMED,PASSENGERS,ORIGIN_STATE_ABR
11958,"Nizhniy Novgorod, Russia: Strigino",0.0,0.0,
11959,"Gold Beach, OR: Gold Beach Municipal",0.0,0.0,
11960,"Goma, Congo (Kinshasa): Goma Airport",0.0,0.0,
11961,"New London/Groton, CT: Groton-New London",0.0,0.0,
11962,"Goondiwindi, Australia: Goondiwindi Airport",0.0,0.0,
11963,"Gorakhpur, India: Gorakhpur Airport",0.0,0.0,
11964,"Gore, Ethiopia: Gore Airport",0.0,0.0,
11965,"Gosford, Australia: Gosford Airport",0.0,0.0,
11966,"Gothenburg, Sweden: Landvetter",0.0,0.0,
11967,"Garoua, Cameroon: Garoua Airport",0.0,0.0,
11968,"Gove, Australia: Gove Airport",0.0,0.0,
11969,"Gorna Oryahovitsa, Bulgaria: Gorna Oryahovitsa Airport",0.0,0.0,
11970,"Guapi, Colombia: Guapi Airport",0.0,0.0,
11971,"Grand Prairie, TX: Grand Prairie Municipal",0.0,0.0,
11972,"Galapagos Islands, Ecuador: Baltra",0.0,0.0,
11973,"Gulfport/Biloxi, MS: Gulfport-Biloxi International",164.0,6384.0,MS
11974,"Grand Rapids, MN: Grand Rapids/Itasca County-Gordon Newstrom Field",0.0,0.0,
11975,"Galion, OH: Horning",0.0,0.0,
11976,"Gamarra, Colombia: Germania",0.0,0.0,
11977,"Green Bay, WI: Green Bay Austin Straubel International",96.0,3059.0,WI
11978,"Greenwood, SC: Greenwood County",0.0,0.0,
11979,"Tacoma, WA: Gray AAF",0.0,0.0,
11980,"Grand Island, NE: Central Nebraska Regional",47.0,1950.0,NE
11981,"George, South Africa: George Airport",0.0,0.0,
11982,"Killeen, TX: Robert Gray AAF",76.0,3787.0,TX
11983,"Gerona, Spain: Gerona Costa Brava",0.0,0.0,
11984,"Gurupi, Brazil: Gurupi Airport",0.0,0.0,
11985,"Groningen, Netherlands: Eelde",0.0,0.0,
11986,"Grand Rapids, MI: Gerald R. Ford International",547.0,36486.0,MI
11987,"Grosseto, Italy: Grosseto Airport",0.0,0.0,
11988,"Sao Paulo, Brazil: Guarulhos Gov Andre Franco Montoro",0.0,0.0,
11989,"Graciosa Island, Portugal: Graciosa Island Airport",0.0,0.0,
11990,"Granada, Spain: Granada Airport",0.0,0.0,
11991,"Graz, Austria: Graz Airport",0.0,0.0,
11992,"Goldsboro, NC: Seymour Johnson AFB",0.0,0.0,
11993,"Gothenburg, Sweden: Gothenburg City",0.0,0.0,
11994,"Goshen, IN: Goshen Municipal",0.0,0.0,
11995,"Greensboro/High Point, NC: Piedmont Triad International",377.0,15949.0,NC
11996,"Greer, SC: Greenville-Spartanburg International",527.0,25030.0,SC
11997,"Gustavus, AK: Gustavus Airport",82.0,260.0,AK
11999,"Dallas/Fort Worth, TX: Greater Southwest International",0.0,0.0,
12000,"San Jose, Guatemala: San Jose Airport",0.0,0.0,
12001,"Genting, Malaysia: Genting Airport",0.0,0.0,
12002,"Groote Island, Australia: Groote Eylandt",0.0,0.0,
12003,"Great Falls, MT: Great Falls International",111.0,3542.0,MT
12004,"Sungei Tekai, Malaysia: Sungei Tekai Airport",0.0,0.0,
12005,"Mount Cook, New Zealand: Glentanner",0.0,0.0,
12006,"Gorontalo, Indonesia: Djalaluddin",0.0,0.0,
12007,"Columbus, MS: Golden Triangle Regional",30.0,461.0,MS
12008,"Georgetown, TX: Georgetown Exec",0.0,0.0,
12009,"Zlin, Czech Republic: Holesov",0.0,0.0,
12010,"Guatemala City, Guatemala: La Aurora International",0.0,0.0,
12011,"Guerrero Negro, Mexico: Guerrero Negro Airport",0.0,0.0,
12012,"Gunnison, CO: Gunnison-Crested Butte Regional",13.0,215.0,CO
12013,"Goundam, Mali: Goundam Airport",0.0,0.0,
12014,"Gunnedah, Australia: Gunnedah Airport",0.0,0.0,
12015,"Guiria, Venezuela: Almirante Cristobal Colon",0.0,0.0,
12016,"Guam, TT: Guam International",43.0,2948.0,TT
12017,"Gualaco, Honduras: Jicalapa",0.0,0.0,
12018,"Gallup, NM: Gallup Municipal",0.0,0.0,
12019,"Guanare, Venezuela: Guanare Airport",0.0,0.0,
12020,"Alotau, Papua New Guinea: Gurney",0.0,0.0,
12021,"Peru, IN: Grissom ARB",0.0,0.0,
12022,"Gutersloh, Germany: Gutersloh Airport",0.0,0.0,
12023,"Atyrau, Kazakhstan: Atyrau Airport",0.0,0.0,
12024,"Guymon, OK: Guymon Municipal",0.0,0.0,
12025,"Guiratinga, Brazil: Guiratinga Airport",0.0,0.0,
12026,"Geneva, Switzerland: Geneva Airport",0.0,0.0,
12027,"Gordonville, VA: Gordonsville Municipal",0.0,0.0,
12028,"Gainesville, GA: Lee Gilmer Memorial",0.0,0.0,
12029,"Batavia, NY: Genesee County",0.0,0.0,
12030,"Governador Valadares, Brazil: Coronel Altino Machado",0.0,0.0,
12031,"Greenville, TX: Majors",0.0,0.0,
12032,"Grandview, MO: Richards/Gebaur AFB",0.0,0.0,
12033,"Gavle, Sweden: Gavle Airport",0.0,0.0,
12034,"Gwadar, Pakistan: Gwadar International",0.0,0.0,
12035,"Gweru, Zimbabwe: Gweru Thornhill",0.0,0.0,
12038,"Gwalior, India: Gwalior Airport",0.0,0.0,
12039,"Greenwood, MS: Greenwood/Leflore",0.0,0.0,MS
12040,"Gwinner, ND: Gwinner-Roger Melroe Field",0.0,0.0,
12041,"Glenwood Springs, CO: Glenwood Springs Municipal",0.0,0.0,
12042,"Westerland-Sylt, Germany: Sylt",0.0,0.0,
12044,"Galway, Ireland: Carnmore",0.0,0.0,
12045,"Sayun, Yemen: Sayun International",0.0,0.0,
12046,"Mildenhall, United Kingdom: Mildenhall NAF",0.0,0.0,
12047,"Coyhaique, Chile: Teniente Vidal",0.0,0.0,
12048,"Yagoua, Cameroon: Yagoua Ville",0.0,0.0,
12049,"Guayaramerin, Bolivia: Guayaramerin Airport",0.0,0.0,
12050,"Baku, Azerbaijan: Baku Metropolitan Area",0.0,0.0,
12051,"Guayaquil, Ecuador: Jose Joaquin de Olmedo International",0.0,0.0,
12052,"Guaymas, Mexico: Guaymas International",0.0,0.0,
12053,"Goiania, Brazil: Santa Genoveva International",0.0,0.0,
12054,"Goodyear, AZ: Phoenix Goodyear",0.0,0.0,
12055,"Gary, IN: Gary/Chicago International",0.0,0.0,
12056,"Gizo, Solomon Islands: Gizo Airport",0.0,0.0,
12057,"Gaziantep, Turkey: Gaziantep Airport",0.0,0.0,
12058,"Hamilton, AL: Marion County",0.0,0.0,
12059,"Hachijo Jima Island, Japan: Hachijo Jima Island Airport",0.0,0.0,
12060,"Halmstad, Sweden: Halmstad Airport",0.0,0.0,
12061,"Havasupai, AZ: Havasupai Airport",0.0,0.0,
12062,"Half Moon Bay, CA: Half Moon Bay Airport",0.0,0.0,
12063,"Moroni, Comoros: Prince Said Ibrahim",0.0,0.0,
12064,"Hannover, Germany: Hannover Airport",0.0,0.0,
12065,"Haikou, China: Meilan",0.0,0.0,
12066,"Hamburg, Germany: Hamburg Airport",0.0,0.0,
12067,"Hanoi, Vietnam: Noibai International",0.0,0.0,
12068,"Hamilton, OH: Butler County Regional Hogan Field",0.0,0.0,
12069,"Long Island, Australia: Long Island Airport",0.0,0.0,
12070,"Harrisburg, PA: Capital City",0.0,0.0,
12071,"Hail, Saudi Arabia: Hail Airport",0.0,0.0,
12072,"Haugesund, Norway: Karmoy",0.0,0.0,
12073,"Havana, Cuba: Jose Marti International",0.0,0.0,
12074,"Haycock, AK: Haycock Airport",0.0,0.0,
12075,"Hobart, Australia: Hobart Airport",0.0,0.0,
12076,"Hanus Bay, AK: Hanus Bay Airport",0.0,0.0,
12077,"Alexandria, Egypt: Borg El Arab",0.0,0.0,
12078,"Hattiesburg, MS: Hattiesburg Bobby L. Chain Municipal",0.0,0.0,
12079,"Hobart Bay, AK: Hobart Bay Airport",0.0,0.0,
12080,"Harbour Island, The Bahamas: Harbour Island Airport",0.0,0.0,
12081,"Babelegi, South Africa: Babelegi Heliport",0.0,0.0,
12082,"Hafr Al Batin, Saudi Arabia: Al Batin",0.0,0.0,
12083,"Hebbronville, TX: Jim Hogg County",0.0,0.0,
12084,"Hood Bay, AK: Hood Bay Airport",0.0,0.0,
12085,"Big Spring, TX: Howard County",0.0,0.0,
12086,"Shoal Cove, AK: Shoal Cove Airport",0.0,0.0,
12087,"Holy Cross, AK: Holy Cross Airport",36.0,4.0,AK
12088,"Hidden Falls, AK: Hidden Falls Airport",0.0,0.0,
12089,"Heidelberg, Germany: Heidelberg AHP",0.0,0.0,
12090,"Hyderabad, Pakistan: Hyderabad Airport",0.0,0.0,
12091,"Heringsdorf, Germany: Heringsdorf Airport",0.0,0.0,
12092,"Mokuleia, HI: Dillingham",0.0,0.0,
12093,"Hamadan, Iran: Hamadan Airport",0.0,0.0,
12094,"Hayden, CO: Yampa Valley",28.0,561.0,CO
12095,"Hoedspruit, South Africa: Hoedspruit Airport",0.0,0.0,
12096,"Hat Yai, Thailand: Hat Yai International",0.0,0.0,
12097,"Herat, Afghanistan: Khwaja Abdullah Ansari International",0.0,0.0,
12098,"Herendeen, AK: Herendeen Bay",0.0,0.0,
12099,"Heho, Burma: Heho Airport",0.0,0.0,
12100,"Heide/Busum, Germany: Heide Buesum",0.0,0.0,
12101,"Helsinki, Finland: Helsinki Vantaa",0.0,0.0,
12102,"Heraklion, Greece: Nikos Kazantzakis",0.0,0.0,
12103,"Hermiston, OR: Hermiston Municipal",0.0,0.0,
12104,"Hohhot, China: Baita",0.0,0.0,
12105,"Santo Domingo, Dominican Republic: Herrera International",0.0,0.0,
12106,"Natchez, MS: Hardy-Anders Field Natchez-Adams County",0.0,0.0,
12107,"Haifa, Israel: Haifa Airport",0.0,0.0,
12108,"Hartford, CT: Hartford Brainard",0.0,0.0,
12109,"Hefei, China: Luogang",0.0,0.0,
12110,"Hoffman, NC: Mackall AAF",0.0,0.0,
12111,"Hofn, Iceland: Hornafjordur",0.0,0.0,
12112,"Hammerfest, Norway: Hammerfest Airport",0.0,0.0,
12113,"Hargeisa, Somalia: Egal International",0.0,0.0,
12114,"Hughenden, Australia: Hughenden Airport",0.0,0.0,
12115,"Hangzhou, China: Xiaoshan",0.0,0.0,
12116,"Dune, Germany: Helgoland Duene",0.0,0.0,
12117,"Mae Hong Son, Thailand: Mae Hong Son Airport",0.0,0.0,
12118,"Korhogo, Cote d'Ivoire: Korhogo Airport",0.0,0.0,
12119,"Hagerstown, MD: Hagerstown Regional-Richard A. Henson Field",25.0,2280.0,MD
12120,"Freetown, Sierra Leone: Hastings",0.0,0.0,
12121,"Mount Hagen, Papua New Guinea: Mount Hagen Airport",0.0,0.0,
12122,"Hogatza, AK: Hogatza Airport",0.0,0.0,
12123,"Hachinohe, Japan: Hachinohe Airport",0.0,0.0,
12124,"Hilton Head, SC: Hilton Head Airport",117.0,4348.0,SC
12125,"Hahn, Germany: Frankfurt Hahn",0.0,0.0,
12126,"Hong Kong, Hong Kong: Kai Tak Heliport",0.0,0.0,
12127,"Hawthorne, CA: Jack Northrop Field/Hawthorne Municipal",34.0,65.0,CA
12128,"Hiawatha, KS: Hiawatha Municipal",0.0,0.0,
12129,"Hibbing, MN: Range Regional",30.0,375.0,MN
12130,"Whitefield, NH: Mount Washington Regional",0.0,0.0,
12131,"Ogden, UT: Hill AFB",0.0,0.0,
12132,"Lake Havasu City, AZ: Lake Havasu City Airport",0.0,0.0,
12133,"Hiroshima, Japan: Hiroshima Airport",0.0,0.0,
12134,"Honolulu, HI: Daniel K Inouye International",0.0,0.0,
12135,"Jinju, South Korea: Sacheon AB",0.0,0.0,
12136,"Hillsboro, OR: Portland Hillsboro",0.0,0.0,
12137,"Honiara, Solomon Islands: Honiara International",0.0,0.0,
12138,"Hayman Island, Australia: Hayman Island Airport",0.0,0.0,
12139,"Khajuraho, India: Khajuraho Airport",0.0,0.0,
12140,"Blytheville, AR: Blytheville Municipal",0.0,0.0,
12141,"Healy, AK: Healy River",22.0,12.0,AK
12142,"Hakodate, Japan: Hakodate Airport",0.0,0.0,
12143,"Hong Kong, Hong Kong: Hong Kong International",0.0,0.0,
12144,"Hokitika, New Zealand: Hokitika Airport",0.0,0.0,
12145,"Hoskins, Papua New Guinea: Hoskins Airport",0.0,0.0,
12146,"Kaanapali, HI: Kaanapali Airport",0.0,0.0,
12147,"Jackson, MS: Hawkins Field",0.0,0.0,
12148,"Phuket, Thailand: Phuket International",0.0,0.0,
12149,"Hickory, NC: Hickory Regional",0.0,0.0,
12150,"Lanseria, South Africa: Lanseria International",0.0,0.0,
12151,"Hailar, China: Hailar Airport",0.0,0.0,
12152,"Hultsfred, Sweden: Hultsfred Vimmerby",0.0,0.0,
12153,"Wheeling, WV: Wheeling Ohio County",0.0,0.0,
12154,"Hollister, CA: Hollister Municipal",0.0,0.0,
12155,"Holland, MI: Park Township",0.0,0.0,
12156,"Helena, MT: Helena Regional",74.0,1928.0,MT
12157,"Holbrook, AZ: Holbrook Municipal",0.0,0.0,
12158,"Jakarta, Indonesia: Halim Perdanakusuma International",0.0,0.0,
12159,"Hamilton, Australia: Hamilton Airport",0.0,0.0,
12160,"Hamilton, New Zealand: Hamilton Airport",0.0,0.0,
12162,"Hassi Messaoud, Algeria: Krim Belkacem",0.0,0.0,
12163,"Alamogordo, NM: Holloman AFB",0.0,0.0,
12164,"Hermosillo, Mexico: Hermosillo International",0.0,0.0,
12165,"Homeshore, AK: Homeshore Airport",0.0,0.0,
12166,"Hemet, CA: Hemet-Ryan",0.0,0.0,
12167,"Hanamaki, Japan: Hanamaki Airport",0.0,0.0,
12168,"Hatteras, NC: Billy Mitchell",0.0,0.0,
12169,"Tokyo, Japan: Tokyo International",0.0,0.0,
12170,"Hienghene, New Caledonia: Hienghene/Henri Martinet",0.0,0.0,
12171,"Hoonah, AK: Hoonah Airport",90.0,425.0,AK
12173,"Honolulu, HI: Daniel K Inouye International",1966.0,101030.0,HI
12174,"Hana, HI: Hana Airport",37.0,41.0,HI
12175,"Haines, AK: Haines Airport",136.0,592.0,AK
12177,"Hobbs, NM: Lea County Regional",13.0,227.0,NM
12178,"Hodeidah, Yemen: Hodeidah International",0.0,0.0,
12179,"Hofuf, Saudi Arabia: Al Ahsa",0.0,0.0,
12180,"Holguin, Cuba: Frank Pais International",0.0,0.0,
12181,"Hao Island, French Polynesia: Hao",0.0,0.0,
12182,"Hooker Creek, Australia: Hooker Creek Airport",0.0,0.0,
12183,"Holikachuk, AK: Holikachuk Airport",0.0,0.0,
12184,"Homer, AK: Homer Airport",89.0,184.0,AK
12185,"Huron, SD: Huron Regional",0.0,0.0,
12187,"Hopkinsville, KY: Campbell AAF",0.0,0.0,
12188,"Hof, Germany: Hof Plauen",0.0,0.0,
12189,"Horta, Portugal: Horta Airport",0.0,0.0,
12190,"Hot Springs, AR: Memorial Field",77.0,245.0,AR
12191,"Houston, TX: William P Hobby",2470.0,193128.0,TX
12192,"Orsta/Volda, Norway: Orsta Volda",0.0,0.0,
12193,"Balboa, Panama: Panama Pacifico International",0.0,0.0,
12194,"Lifuka, Tonga: Salote Pilolevu",0.0,0.0,
12195,"Hooper Bay, AK: Hooper Bay Airport",139.0,288.0,AK
12196,"Hai Phong, Vietnam: Catbi International",0.0,0.0,
12197,"White Plains, NY: Westchester County",137.0,627.0,NY
12198,"Hampton, IA: Hampton Municipal",0.0,0.0,
12199,"Hanalei, HI: Princeville",0.0,0.0,
12200,"Hoquiam, WA: Bowerman",0.0,0.0,
12201,"Harbin, China: Taiping",0.0,0.0,
12203,"Harare, Zimbabwe: Robert Gabriel Mugabe International",0.0,0.0,
12204,"Hurghada, Egypt: Hurghada International",0.0,0.0,
12205,"Kharkov, Ukraine: Kharkov Airport",0.0,0.0,
12206,"Harlingen/San Benito, TX: Valley International",142.0,8182.0,TX
12207,"Harrison, AR: Boone County",78.0,311.0,AR
12209,"Harrogate, United Kingdom: Linton-On-Ouse",0.0,0.0,
12210,"Shaoguan, China: Shaoguan Airport",0.0,0.0,
12211,"Las Vegas, NV: Henderson Executive",0.0,0.0,
12212,"Hastings, NE: Hastings Municipal",0.0,0.0,
12213,"Huesca, Spain: Huesca Airport",0.0,0.0,
12214,"Huslia, AK: Huslia Airport",44.0,112.0,AK
12215,"Hot Springs, VA: Ingalls Field",0.0,0.0,
12216,"Homestead, FL: Homestead ARB",0.0,0.0,
12217,"Huntsville, AL: Huntsville International-Carl T Jones Field",288.0,10976.0,AL
12218,"Chita, Russia: Kadala",0.0,0.0,
12219,"Hatfield, United Kingdom: Hatfield Airport",0.0,0.0,
12220,"Hawthorne, NV: Hawthorne Industrial",0.0,0.0,
12221,"Hamilton Island, Australia: Hamilton Island Airport",0.0,0.0,
12222,"East Hampton, NY: East Hampton Town",0.0,0.0,
12223,"Ashland, WV: Tri-State/Milton J. Ferguson Field",127.0,9308.0,WV
12224,"Hato Corozal, Colombia: Hato Corozal Airport",0.0,0.0,
12225,"Huntsville, AL: Redstone AAF",0.0,0.0,
12226,"Humacao, PR: Dr Hermenegildo Ortiz Quinones",0.0,0.0,
12227,"Humera, Ethiopia: Humera Airport",0.0,0.0,
12228,"Terre Haute, IN: Terre Haute Regional",0.0,0.0,
12229,"Huehuetenango, Guatemala: Huehuetenango Airport",0.0,0.0,
12230,"Huahine, French Polynesia: Huahine Fare",0.0,0.0,
12231,"Hue, Vietnam: Phubai International",0.0,0.0,
12232,"Houlton, ME: Houlton International",0.0,0.0,
12233,"Houma, LA: Houma Terrebonne",0.0,0.0,
12234,"Hualien, Taiwan: Hualien Airport",0.0,0.0,
12235,"Hughes, AK: Hughes Airport",26.0,55.0,AK
12236,"Hutchinson, KS: Hutchinson Regional",0.0,0.0,
12237,"Huanuco, Peru: Alferez FAP David Figueroa Fernandini",0.0,0.0,
12238,"Hudiksvall, Sweden: Hudiksvall Airport",0.0,0.0,
12239,"Santa Cruz/Huatulco, Mexico: Bahias de Huatulco International",0.0,0.0,
12240,"Humberside, United Kingdom: Humberside Airport",0.0,0.0,
12241,"Analalava, Madagascar: Analalava Airport",0.0,0.0,
12242,"Hervey Bay, Australia: Hervey Bay Airport",0.0,0.0,
12243,"Hopkinsville, KY: Hopkinsville-Christian County",0.0,0.0,
12244,"New Haven, CT: Tweed New Haven",21.0,571.0,CT
12245,"Havre, MT: Havre City-County",60.0,148.0,MT
12246,"Hartsville, SC: Hartsville Regional",0.0,0.0,
12247,"Hayward, CA: Hayward Executive",0.0,0.0,
12248,"Hawk Inlet, AK: Hawk Inlet Airport",0.0,0.0,
12250,"Hyannis, MA: Cape Cod Gateway",371.0,788.0,MA
12251,"Hyderabad, India: Hyderabad Airport",0.0,0.0,
12252,"Hydaburg, AK: Hydaburg Seaplane Base",7.0,0.0,AK
12253,"Hollis, AK: Hollis Seaplane Base",36.0,29.0,AK
12254,"Hayward, WI: Sawyer County",0.0,0.0,
12255,"Hays, KS: Hays Regional",60.0,627.0,KS
12257,"Liping City, China: Liping",0.0,0.0,
12258,"Husavik, Iceland: Husavik Airport",0.0,0.0,
12259,"Hazleton, PA: Hazleton Regional",0.0,0.0,
12260,"Shenandoah, IA: Shenandoah Municipal",0.0,0.0,
12261,"Webster City, IA: Webster City Municipal",0.0,0.0,
12262,"Red Oak, IA: Red Oak Municipal",0.0,0.0,
12263,"Wichita, KS: McConnell AFB",0.0,0.0,
12264,"Washington, DC: Washington Dulles International",2405.0,113227.0,VA
12265,"Niagara Falls, NY: Niagara Falls International",35.0,2402.0,NY
12266,"Houston, TX: George Bush Intercontinental/Houston",4055.0,253472.0,TX
12267,"In Amenas, Algeria: In Amenas Airport",0.0,0.0,
12268,"Kiana, AK: Bob Baker Memorial",46.0,98.0,AK
12269,"Yaroslavl, Russia: Yaroslavl Airport",0.0,0.0,
12270,"Iasi, Romania: Iasi International",0.0,0.0,
12271,"Ibadan, Nigeria: Ibadan Airport",0.0,0.0,
12272,"Ibague, Colombia: Perales",0.0,0.0,
12273,"Itambacuri, Brazil: Itambacuri Airport",0.0,0.0,
12274,"Ibiza, Spain: Ibiza Airport",0.0,0.0,
12275,"Cicia, Fiji: Cicia Airport",0.0,0.0,
12276,"Nieuw Nickerie, Suriname: Nieuw",0.0,0.0,
12277,"Seoul, South Korea: Incheon International",0.0,0.0,
12278,"Wichita, KS: Wichita Dwight D Eisenhower National",468.0,21749.0,KS
12279,"Icy Bay, AK: Icy Bay Airport",0.0,0.0,
12280,"Idaho Falls, ID: Idaho Falls Regional",147.0,6904.0,ID
12281,"Indiana, PA: Indiana County Jimmy Stewart Field",0.0,0.0,
12282,"Santa Isabel Do Morro, Brazil: Santa Isabel Do Morro Airport",0.0,0.0,
12283,"Independence, KS: Independence Municipal",0.0,0.0,
12284,"Indore, India: Devi Ahilyabai Holkar",0.0,0.0,
12285,"Baldonnel, Ireland: Casement",0.0,0.0,
12286,"Zielona Gora, Poland: Babimost",0.0,0.0,
12287,"Kiev, Ukraine: Zhuliany",0.0,0.0,
12288,"Isafjordur, Iceland: Isafjordur Airport",0.0,0.0,
12289,"Innisfail, Australia: Innisfail Airport",0.0,0.0,
12290,"Isfahan, Iran: Shahid Beheshti International",0.0,0.0,
12291,"Ivano-Frankovska, Ukraine: Ivano Frankivsk",0.0,0.0,
12293,"Inagua, The Bahamas: Inagua Airport",0.0,0.0,
12294,"Igiugig, AK: Igiugig Airport",15.0,3.0,AK
12295,"Ingham, Australia: Ingham Airport",0.0,0.0,
12296,"Izmir, Turkey: Cigli",0.0,0.0,
12297,"Kingman, AZ: Kingman Airport",0.0,0.0,
12298,"Iligan, Philippines: Maria Cristina",0.0,0.0,
12299,"Chigorodo, Colombia: Chigorodo Airport",0.0,0.0,
12300,"Iguazu, Argentina: Cataratas",0.0,0.0,
12302,"Iguacu Falls, Brazil: Cataratas International",0.0,0.0,
12303,"Chapel Hill, NC: Horace Williams",0.0,0.0,
12304,"Ihu, Papua New Guinea: Ihu Airport",0.0,0.0,
12305,"Rantoul, IL: Rantoul National Aviation Center",0.0,0.0,
12306,"Chicago/Romeoville, IL: Lewis University",0.0,0.0,
12307,"De Kalb, IL: De Kalb Taylor Municipal",0.0,0.0,
12308,"Lincoln, IL: Logan County",0.0,0.0,
12309,"Ijui, Brazil: Ijui Airport",0.0,0.0,
12310,"Jacksonville, IL: Jacksonville Municipal",0.0,0.0,
12311,"Tehran, Iran: Imam Khomaini International",0.0,0.0,
12312,"Wilkesboro, NC: Wilkes County",0.0,0.0,
12313,"Iki, Japan: Iki Airport",0.0,0.0,
12314,"Kankakee, IL: Greater Kankakee",0.0,0.0,
12315,"Nikolski, AK: Nikolski AS",8.0,5.0,AK
12316,"Irkutsk, Russia: Irkutsk Airport",0.0,0.0,
12317,"Ankeny, IA: Ankeny Regional",0.0,0.0,
12318,"Nevatim, Israel: Nevatim AB",0.0,0.0,
12319,"Killeen, TX: Skylark Field",0.0,0.0,
12320,"Wilmington, DE: New Castle",0.0,0.0,
12321,"Iliamna, AK: Iliamna Airport",81.0,74.0,AK
12322,"Willmar, MN: Willmar Municipal",0.0,0.0,
12323,"Wilmington, NC: Wilmington International",253.0,10617.0,NC
12324,"Wilmington, OH: Wilmington Air Park",0.0,0.0,
12325,"Iloilo, Philippines: Iloilo Airport",0.0,0.0,
12326,"Ile Des Pins, New Caledonia: Ile Des Pins Moue",0.0,0.0,
12327,"Ilo, Peru: Ilo Airport",0.0,0.0,
12328,"Ilorin, Nigeria: Ilorin Airport",0.0,0.0,
12329,"Islay, United Kingdom: Islay Airport",0.0,0.0,
12330,"Zilina, Slovakia: Zilina International",0.0,0.0,
12331,"Imphal, India: Imphal Airport",0.0,0.0,
12332,"Imperial, NE: Imperial Municipal",0.0,0.0,
12333,"Immokalee, FL: Immokalee Regional",0.0,0.0,
12334,"Imperatriz, Brazil: Imperatriz Airport",0.0,0.0,
12335,"Iron Mountain/Kingsfd, MI: Ford",57.0,606.0,MI
12336,"Auburn, IN: De Kalb County",0.0,0.0,
12337,"Indianapolis, IN: Indianapolis Executive",0.0,0.0,
12338,"Yinchuan, China: Hedong",0.0,0.0,
12339,"Indianapolis, IN: Indianapolis International",1494.0,113808.0,IN
12340,"In Guezzam, Algeria: In Guezzam Airport",0.0,0.0,
12341,"Lago Argentino, Argentina: Lago Argentino Airport",0.0,0.0,
12342,"Inhambane, Mozambique: Inhambane Airport",0.0,0.0,
12343,"International Falls, MN: Falls International Einarson Field",33.0,108.0,MN
12344,"Innsbruck, Austria: Innsbruck Airport",0.0,0.0,
12345,"Inongo, Congo (Kinshasa): Inongo Airport",0.0,0.0,
12347,"Indian Springs, NV: Creech AFB",0.0,0.0,
12348,"Winston-Salem, NC: Smith Reynolds",0.0,0.0,
12349,"Nauru, Nauru: Nauru Island",0.0,0.0,
12350,"Inverness, United Kingdom: Inverness Airport",0.0,0.0,
12351,"Winslow, AZ: Winslow-Lindbergh Regional",0.0,0.0,
12352,"Ioannina, Greece: Ioannina Airport",0.0,0.0,
12353,"Isle of Man, United Kingdom: Isle of Man Airport",0.0,0.0,
12354,"Impfondo, Congo (Brazaville): Impfondo Airport",0.0,0.0,
12355,"Inishmore, Ireland: Inishmore Airport",0.0,0.0,
12356,"Ilheus, Brazil: Jorge Amado",0.0,0.0,
12357,"Ile Ouen, New Caledonia: Ile Ouen Airport",0.0,0.0,
12358,"Iowa City, IA: Iowa City Municipal",0.0,0.0,
12359,"Easter Island, Chile: Mataveri International",0.0,0.0,
12360,"Ipil, Philippines: Ipil Airport",0.0,0.0,
12361,"Ipoh, Malaysia: Ipoh Sultan Azlan Shah",0.0,0.0,
12362,"Ipiales, Colombia: San Luis",0.0,0.0,
12363,"El Centro, CA: Imperial County",103.0,141.0,CA
12364,"Ipatinga, Brazil: Usiminas",0.0,0.0,
12365,"Williamsport, PA: Williamsport Regional",21.0,518.0,PA
12366,"Al Taqaddum, Iraq: Al Taqaddum AB",0.0,0.0,
12367,"Al Asad, Iraq: Al Asad AB",0.0,0.0,
12368,"Iquique, Chile: Diego Aracena International",0.0,0.0,
12369,"Iquitos, Peru: Coronel Francisco Secada Vignetta International",0.0,0.0,
12370,"Circle, AK: Circle City",22.0,13.0,AK
12371,"Ishurdi, Bangladesh: Ishurdi Airport",0.0,0.0,
12372,"Iron Range, Australia: Iron Range Airport",0.0,0.0,
12373,"Iringa, Tanzania: Iringa Airport",0.0,0.0,
12374,"La Rioja, Argentina: Capitan Vicente A Almonacid",0.0,0.0,
12375,"Kirksville, MO: Kirksville Regional",90.0,168.0,MO
12376,"Birao, Central African Republic: Birao Airport",0.0,0.0,
12377,"Isiro, Congo (Kinshasa): Isiro Airport",0.0,0.0,
12378,"Sturgis, MI: Sturgis Airport",0.0,0.0,
12379,"Bayou La Batre, AL: Roy E. Ray",0.0,0.0,
12380,"Mount Isa, Australia: Mount Isa Airport",0.0,0.0,
12381,"Islamabad, Pakistan: Benazir Bhutto International",0.0,0.0,
12382,"Scilly Isles, United Kingdom: Scilly Isles Airport",0.0,0.0,
12383,"Ishigaki, Japan: Ishigaki Airport",0.0,0.0,
12384,"Ischia, Italy: Ischia Airport",0.0,0.0,
12385,"Isisford, Australia: Isisford Airport",0.0,0.0,
12386,"Isla Mujeres, Mexico: Isla Mujeres Airport",0.0,0.0,
12387,"Isabel Pass, AK: Isabel Pass Airport",0.0,0.0,
12388,"Orlando, FL: Kissimmee Gateway",0.0,0.0,
12389,"Williston, ND: Sloulin Field International",0.0,0.0,
12390,"Kinston, NC: Kinston Regional Jetport at Stallings Field",0.0,0.0,
12391,"Islip, NY: Long Island MacArthur",161.0,11178.0,NY
12392,"Manistique, MI: Schoolcraft County",0.0,0.0,
12393,"Istres, France: Istres Le Tube",0.0,0.0,
12394,"Wiscasset, ME: Wiscasset Airport",0.0,0.0,
12395,"Istanbul, Turkey: Istanbul Airport",0.0,0.0,
12396,"Wisconsin Rapids, WI: Alexander Field South Wood County",0.0,0.0,
12397,"Ithaca/Cortland, NY: Ithaca Tompkins International",76.0,1481.0,NY
12400,"Osaka, Japan: Osaka International",0.0,0.0,
12401,"Itabuna, Brazil: Tertuliano Guedes de Pinho",0.0,0.0,
12402,"Hilo, HI: Hilo International",282.0,14254.0,HI
12403,"Itaqui, Brazil: Itaqui Airport",0.0,0.0,
12404,"Niue Island, Niue: Niue International",0.0,0.0,
12405,"Inus, Papua New Guinea: Inus Airport",0.0,0.0,
12406,"Ambanja, Madagascar: Ambanja/Ambalavelona",0.0,0.0,
12407,"Invercargill, New Zealand: Invercargill Airport",0.0,0.0,
12408,"Berane, Montenegro: Berane Airport",0.0,0.0,
12409,"Ivalo, Finland: Ivalo Airport",0.0,0.0,
12410,"Inverell, Australia: Inverell Airport",0.0,0.0,
12411,"Ivanovo, Russia: Ivanovo Airport",0.0,0.0,
12412,"Ironwood, MI: Gogebic-Iron County",0.0,0.0,
12413,"Iwami, Japan: Iwami Airport",0.0,0.0,
12414,"Iwoto, Japan: Iwoto Airport",0.0,0.0,
12415,"Houston, TX: West Houston",0.0,0.0,
12416,"Agartala, India: Agartala Airport",0.0,0.0,
12417,"Bagdogra, India: Bagdogra Airport",0.0,0.0,
12418,"Chandigarh, India: Chandigarh Airport",0.0,0.0,
12419,"Allahabad, India: Allahabad Airport",0.0,0.0,
12420,"Mangalore, India: Mangalore International",0.0,0.0,
12421,"Belgaum, India: Belagavi",0.0,0.0,
12422,"Kailashahar, India: Kailashahar Airport",0.0,0.0,
12423,"Lilabari, India: North Lakhimpur/Lilabari",0.0,0.0,
12424,"Jammu, India: Jammu Airport",0.0,0.0,
12425,"Keshod, India: Keshod Airport",0.0,0.0,
12426,"Leh, India: Leh Airport",0.0,0.0,
12427,"Madurai, India: Madurai Airport",0.0,0.0,
12429,"Kamalpur, India: Kamalpur Airport",0.0,0.0,
12430,"Ranchi, India: Ranchi Airport",0.0,0.0,
12431,"Silchar, India: Silchar Airport",0.0,0.0,
12432,"Aurangabad, India: Aurangabad Airport",0.0,0.0,
12433,"Jamshedpur, India: Jamshedpur Airport",0.0,0.0,
12434,"Kandla, India: Kandla Airport",0.0,0.0,
12435,"Port Blair, India: Port Blair Airport",0.0,0.0,
12436,"Inyokern, CA: Inyokern Airport",0.0,0.0,
12437,"Izmir, Turkey: Izmir Metropolitan Area",0.0,0.0,
12438,"Izumo, Japan: Izumo Airport",0.0,0.0,
12439,"Ixtepec, Mexico: Ixtepec Airport",0.0,0.0,
12440,"Jabiru, Australia: Jabiru Airport",0.0,0.0,
12441,"Jackson, WY: Jackson Hole",181.0,9040.0,WY
12442,"Jaffna, Sri Lanka: Kankesanturai",0.0,0.0,
12443,"Jacobabad, Pakistan: Shahbaz AB",0.0,0.0,
12444,"Jaipur, India: Jaipur International",0.0,0.0,
12445,"Atlanta, GA: Perimeter Mall Helipad",0.0,0.0,
12446,"Jacmel, Haiti: Jacmel Airport",0.0,0.0,
12447,"Jalapa, Mexico: El Lencero",0.0,0.0,
12448,"Jackson/Vicksburg, MS: Jackson Medgar Wiley Evers International",227.0,9510.0,MS
12449,"Atlanta, GA: Beaver Ruin",0.0,0.0,
12450,"Jakobshavn, Greenland: Ilulissat",0.0,0.0,
12451,"Jacksonville, FL: Jacksonville International",915.0,77027.0,FL
12452,"Boston, MA: Boston City Heliport",0.0,0.0,
12453,"Oakland, CA: Berkeley Municipal Heliport",0.0,0.0,
