ORIGIN_AIRPORT_ID,NAME,DEPARTURES_PERFORMED,PASSENGERS,ORIGIN_STATE_ABR
14935,"San Tome, Venezuela: Don Edmundo Barrios International",0.0,0.0,
14936,"Espiritu Santo, Vanuatu: Espiritu",0.0,0.0,
14938,"Pinehurst/Southern Pines, NC: Moore County",0.0,0.0,
14939,"Sorong, Indonesia: Sorong Airport",0.0,0.0,
14941,"Southampton, United Kingdom: Southampton Airport",0.0,0.0,
14942,"Seldovia, AK: Seldovia Airport",140.0,244.0,AK
14943,"Show Low, AZ: Show Low Regional",82.0,406.0,AZ
14944,"Spartanburg, SC: Spartanburg Downtown Memorial Simpson Field",0.0,0.0,
14945,"Charlotte Amalie, VI: Charlotte Amalie Harbor Seaplane Base",84.0,757.0,VI
14946,"Santa Cruz de la Palma, Spain: La Palma",0.0,0.0,
14947,"Saidpur, Bangladesh: Saidpur Airport",0.0,0.0,
14948,"Sepulot, Malaysia: Sepulot Airport",0.0,0.0,
14949,"Spearfish, SD: Black Hills Clyde Ice Field",0.0,0.0,
14950,"Tampa, FL: Albert Whitted",0.0,0.0,
14951,"Sopu, Papua New Guinea: Sopu Airport",0.0,0.0,
14952,"Springfield, IL: Abraham Lincoln Capital",71.0,1986.0,IL
14953,"Sapporo, Japan: Chitose AB",0.0,0.0,
14954,"Spangdahlem, Germany: Spangdahlem AB",0.0,0.0,
14955,"Saipan, TT: Francisco C. Ada Saipan International",323.0,1684.0,TT
14957,"Menongue, Angola: Menongue Airport",0.0,0.0,
14958,"San Pedro, CA: Catalina Air-Sea Terminal Heliport",0.0,0.0,
14959,"San Pedro, Belize: San Pedro Airport",0.0,0.0,
14960,"Wichita Falls, TX: Sheppard AFB/Wichita Falls Municipal",33.0,949.0,TX
14961,"Split, Croatia: Split Airport",0.0,0.0,
14962,"Spencer, IA: Spencer Municipal",0.0,0.0,
14963,"San Pedro, Cote d'Ivoire: San Pedro Airport",0.0,0.0,
14964,"Springdale, AR: Springdale Municipal",0.0,0.0,
14965,"Santa Ynez, CA: Santa Ynez Airport",0.0,0.0,
14966,"Sterling/Rockfalls, IL: Whiteside County-Jos H. Bittorf Field",0.0,0.0,
14967,"San Carlos, CA: San Carlos Airport",49.0,163.0,CA
14968,"Sanana, Indonesia: Emalamo",0.0,0.0,
14969,"Storuman, Sweden: Storuman Airport",0.0,0.0,
14970,"Siauliai, Lithuania: Siauliai International",0.0,0.0,
14971,"Soroako, Indonesia: Soroako Airport",0.0,0.0,
14972,"Sequim, WA: Sequim Valley",0.0,0.0,
14973,"Santa Rosa, Brazil: Luis Alberto Lehr",0.0,0.0,
14974,"Santa Rosa, Bolivia: Santa Rosa Airport",0.0,0.0,
14975,"Searcy, AR: Searcy Municipal",0.0,0.0,
14976,"Sucre, Bolivia: Juana Azurduy de Padilla",0.0,0.0,
14977,"Novato, CA: Hamilton AFB",0.0,0.0,
14978,"Semarang, Indonesia: Jenderal Ahmad Yani International",0.0,0.0,
14979,"Sarh, Chad: Sarh Airport",0.0,0.0,
14980,"Samarinda, Indonesia: Samarinda Airport",0.0,0.0,
14981,"San Borja, Bolivia: Capitan German Quiroga Guardia",0.0,0.0,
14982,"Santa Rosalia, Mexico: San Lucas",0.0,0.0,
14983,"Strahan, Australia: Strahan Airport",0.0,0.0,
14984,"Santana Ramos, Colombia: Santana Ramos Airport",0.0,0.0,
14985,"Stord, Norway: Stord Airport",0.0,0.0,
14986,"Sarasota/Bradenton, FL: Sarasota/Bradenton International",330.0,27095.0,FL
14987,"Stony River, AK: Stony River Airport",9.0,2.0,AK
14988,"Salisbury, NC: Mid Carolina Regional",0.0,0.0,
14989,"Sert, Libya: Sirte International",0.0,0.0,
14990,"Santa Cruz, Bolivia: El Trompillo",0.0,0.0,
14991,"Salvador, Brazil: Deputado Luis Eduardo Magalhaes International",0.0,0.0,
14992,"Christiansted, VI: Christiansted Harbor Seaplane Base",84.0,757.0,VI
14993,"Sumter, SC: Shaw AFB",0.0,0.0,
14994,"Malabo, Equatorial Guinea: Malabo Airport",0.0,0.0,
14995,"Sharm El Sheikh, Egypt: Sharm El Sheikh International",0.0,0.0,
14996,"Brunswick, GA: St Simons Island",0.0,0.0,
14997,"Sandnessjoen, Norway: Sandnessjoen Airport",0.0,0.0,
14998,"Santa Rosalia, Colombia: Santa Rosalia Airport",0.0,0.0,
14999,"Sault Ste. Marie, MI: Sault Ste. Marie Metropolitan Area",0.0,0.0,
15000,"Seoul, South Korea: Seoul AB",0.0,0.0,
15001,"Siassi, Papua New Guinea: Siassi Airport",0.0,0.0,
15002,"Santa Teresita, Argentina: Santa Teresita Airport",0.0,0.0,
15003,"Stuart Island, WA: Stuart Island Airpark",0.0,0.0,
15004,"Samsun, Turkey: Samsun Airport",0.0,0.0,
15005,"Mbanza Congo, Angola: Mbanza Congo Airport",0.0,0.0,
15006,"Stauning, Denmark: Stauning Airport",0.0,0.0,
15007,"Santa Barbara, Venezuela: Santa Barbara Airport",0.0,0.0,
15008,"St. Cloud, MN: St. Cloud Regional",7.0,640.0,MN
15009,"Santo Domingo, Venezuela: Mayor Guerrero Vivas",0.0,0.0,
15010,"Stevens Point, WI: Stevens Point Municipal",0.0,0.0,
15011,"Starkville, MS: George M. Bryan",0.0,0.0,
15012,"St. George Island, AK: St. George Island Airport",12.0,29.0,AK
15013,"Santiago, Dominican Republic: Cibao International",0.0,0.0,
15014,"St. Joseph, MO: Rosecrans Memorial",0.0,0.0,
15015,"Sterling, CO: Sterling Municipal",0.0,0.0,
15016,"St. Louis, MO: St Louis Lambert International",3312.0,191929.0,MO
15017,"Santarem, Brazil: Eduardo Gomes",0.0,0.0,
15018,"London, United Kingdom: London Stansted",0.0,0.0,
15019,"Stockholm, Sweden: Stockholm Metropolitan Area",0.0,0.0,
15020,"Minneapolis/St. Paul, MN: St. Paul Downtown Holman Field",0.0,0.0,
15021,"St. Marys, PA: St. Marys Municipal",0.0,0.0,
15022,"Stuttgart, Germany: Stuttgart Airport",0.0,0.0,
15023,"Santa Rosa, CA: Charles M. Schulz - Sonoma County",133.0,3695.0,CA
15024,"Charlotte Amalie, VI: Cyril E King",715.0,15168.0,VI
15026,"Stavropol, Russia: Shpakovskoye",0.0,0.0,
15027,"Christiansted, VI: Henry E. Rohlsen",576.0,7576.0,VI
15028,"Salto, Uruguay: Nueva Hesperides International",0.0,0.0,
15029,"Santa Terezinha, Brazil: Santa Terezinha Airport",0.0,0.0,
15030,"Stuart, FL: Witham Field",0.0,0.0,
15031,"Surabaya, Indonesia: Juanda",0.0,0.0,
15032,"Sundance, WY: Schloredt",0.0,0.0,
15033,"Sturgeon Bay, WI: Door County Cherryland",0.0,0.0,
15034,"Lamezia Terme, Italy: Lamezia Terme Airport",0.0,0.0,
15035,"Surigao, Philippines: Surigao Airport",0.0,0.0,
15036,"Sukhumi, Georgia: Babusheri",0.0,0.0,
15037,"Satu Mare, Romania: Satu Mare Airport",0.0,0.0,
15039,"Sui, Pakistan: Sui Airport",0.0,0.0,
15040,"Sumter, SC: Sumter Airport",0.0,0.0,
15041,"Sun Valley/Hailey/Ketchum, ID: Friedman Memorial",47.0,1073.0,ID
15042,"Sunriver, OR: Sunriver Airport",0.0,0.0,
15043,"St. Louis, MO: Spirit of St. Louis",0.0,0.0,
15044,"Sumbawanga, Tanzania: Sumbawanga Airport",0.0,0.0,
15045,"Fairfield, CA: Travis AFB",0.0,0.0,
15046,"Suva, Fiji: Nausori International",0.0,0.0,
15047,"Superior, WI: Richard I Bong",0.0,0.0,
15048,"Sioux City, IA: Sioux Gateway Brig Gen Bud Day Field",22.0,561.0,IA
15049,"Savoonga, AK: Savoonga Airport",62.0,133.0,AK
15050,"Sambava, Madagascar: Sambava Airport",0.0,0.0,
15051,"Silver City/Hurley, NM: Grant County",89.0,148.0,NM
15052,"St. Vincent, Saint Vincent and the Grenadines: E. T. Joshua",0.0,0.0,
15053,"Stavanger, Norway: Stavanger Airport",0.0,0.0,
15054,"Statesville, NC: Statesville Regional",0.0,0.0,
15055,"Svolvaer, Norway: Helle",0.0,0.0,
15056,"Savonlinna, Finland: Savonlinna Airport",0.0,0.0,
15057,"Savannah, GA: Hunter AAF",0.0,0.0,
15058,"Moscow, Russia: Sheremetyevo",0.0,0.0,
15059,"Kuito, Angola: Kuito Airport",0.0,0.0,
15060,"Seville, Spain: Seville Airport",0.0,0.0,
15061,"Stevens Village, AK: Stevens Village Airport",23.0,54.0,AK
15062,"Savusavu, Fiji: Savusavu Airport",0.0,0.0,
15063,"Sparrevohn, AK: Sparrevohn LRRS",0.0,0.0,
15064,"Ekaterinburg, Russia: Koltsovo",0.0,0.0,
15065,"San Antonio, Venezuela: Juan Vicente Gomez International",0.0,0.0,
15066,"Shantou, China: Waisha",0.0,0.0,
15067,"Shaw River, Australia: Shaw River Airport",0.0,0.0,
15068,"Stawell, Australia: Stawell Airport",0.0,0.0,
15069,"Seward, AK: Seward Airport",0.0,0.0,
15070,"Newburgh/Poughkeepsie, NY: New York Stewart International",32.0,3165.0,NY
15072,"Milan, Italy: Segrate",0.0,0.0,
15073,"Spanish Wells, The Bahamas: Spanish Wells Airport",0.0,0.0,
15074,"Stillwater, OK: Stillwater Regional",30.0,562.0,OK
15075,"Sumbawa, Indonesia: Sumbawa Besar",0.0,0.0,
15076,"Swansea, United Kingdom: Swansea Airport",0.0,0.0,
15077,"Suwon, South Korea: Suwon Airport",0.0,0.0,
15078,"Sweetwater, TX: Avenger Field",0.0,0.0,
15079,"Strasbourg, France: Strasbourg Entzheim",0.0,0.0,
15080,"Sale, Australia: West Sale",0.0,0.0,
15081,"Berlin, Germany: Brandenburg",0.0,0.0,
15082,"Senanga, Zambia: Senanga Airport",0.0,0.0,
15083,"Sligo, Ireland: Sligo Airport",0.0,0.0,
15084,"Philipsburg, Sint Maarten: Princess Juliana International",0.0,0.0,
15085,"Sheldon Point, AK: Nunam Iqua",53.0,38.0,AK
15086,"Soldotna, AK: Soldotna Airport",0.0,0.0,
15087,"Srinagar, India: Srinagar Airport",0.0,0.0,
15088,"Soddu, Ethiopia: Soddu Airport",0.0,0.0,
15089,"Sidney, NY: Sidney Municipal",0.0,0.0,
15090,"Shemya, AK: Eareckson AS",0.0,0.0,
15091,"Seal Bay, AK: Seal Bay Airport",9.0,6.0,AK
15092,"Sydney, Australia: Sydney International",0.0,0.0,
15093,"Shelbyville/Tullahoma, TN: Bomar Field-Shelbyville Municipal",0.0,0.0,
15094,"Stanton, MN: Stanton Airfield",0.0,0.0,
15095,"Shonai, Japan: Shonai Airport",0.0,0.0,
15096,"Syracuse, NY: Syracuse Hancock International",385.0,20697.0,NY
15097,"Saint-Yan, France: Saint-Yan Airport",0.0,0.0,
15098,"Sanya, China: Phoenix International",0.0,0.0,
15099,"Stornoway, United Kingdom: Stornoway Airport",0.0,0.0,
15100,"Shiraz, Iran: Shahid Dastghaib International",0.0,0.0,
15101,"Soyo, Angola: Soyo Airport",0.0,0.0,
15102,"Kuala Lumpur, Malaysia: Sultan Abdul Aziz Shah",0.0,0.0,
15103,"Santa Cruz, Costa Rica: Santa Cruz Airport",0.0,0.0,
15104,"Sheffield, United Kingdom: Sheffield City",0.0,0.0,
15105,"Samsun, Turkey: Carsamba",0.0,0.0,
15106,"Salzburg, Austria: Salzburg Airport",0.0,0.0,
15107,"Skukuza, South Africa: Skukuza Airport",0.0,0.0,
15108,"Knob Noster, MO: Whiteman AFB",0.0,0.0,
15109,"Szombathely, Hungary: Szombathely Airport",0.0,0.0,
15110,"Santa Paula, CA: Santa Paula Airport",0.0,0.0,
15111,"San Cristobal, Mexico: San Cristobal de Las Casas",0.0,0.0,
15112,"Schwerin, Germany: Schwerin Parchim",0.0,0.0,
15113,"Shenzhen, China: Bao'an International",0.0,0.0,
15114,"Szczecin, Poland: Goleniow",0.0,0.0,
15115,"Tobago, Trinidad and Tobago: A N R Robinson International",0.0,0.0,
15116,"Tacloban, Philippines: Daniel Z. Romualdez",0.0,0.0,
15117,"Trinidad, CO: Las Animas County",0.0,0.0,
15118,"Taegu, South Korea: Taegu International",0.0,0.0,
15119,"Oran, Algeria: Tafaraoui",0.0,0.0,
15120,"Tagbilaran, Philippines: Tagbilaran Airport",0.0,0.0,
15121,"Tanna Island, Vanuatu: Tanna Island Airport",0.0,0.0,
15122,"Taiz, Yemen: Taiz International",0.0,0.0,
15123,"Takamatsu, Japan: Takamatsu Airport",0.0,0.0,
15124,"Tanana, AK: Ralph M Calhoun Memorial",32.0,84.0,AK
15125,"Tampico, Mexico: Tampico International",0.0,0.0,
15127,"Qingdao, China: Liuting",0.0,0.0,
15128,"Tapachula, Mexico: Tapachula International",0.0,0.0,
15129,"Taranto, Italy: Taranto Grottaglie",0.0,0.0,
15130,"Tashkent, Uzbekistan: Tashkent Islam Karimov International",0.0,0.0,
15131,"Poprad-Tatry, Slovakia: Poprad Tatry",0.0,0.0,
15132,"Tau, TT: Tau Airport",0.0,0.0,
15133,"Taliabu, Indonesia: Taliabu Airport",0.0,0.0,
15134,"Tuy Hoa, Vietnam: Tuy Hoa Airport",0.0,0.0,
15135,"Tabiteuea, Kiribati: Tabiteuea Airport",0.0,0.0,
15136,"New Bight, The Bahamas: The Bight",0.0,0.0,
15137,"Tableland, Australia: Tableland Airport",0.0,0.0,
15138,"Fort Leonard Wood, MO: Waynesville-St. Robert Regional Forney Field",52.0,328.0,MO
15139,"Tabora, Tanzania: Tabora Airport",0.0,0.0,
15140,"Tumbes, Peru: Cap. FAP Pedro Canga Rodriguez",0.0,0.0,
15141,"Statesboro, GA: Statesboro-Bulloch County",0.0,0.0,
15142,"Tbilisi, Georgia: Tbilisi Airport",0.0,0.0,
15143,"Tabatinga, Brazil: Tabatinga Airport",0.0,0.0,
15144,"Tonga Tapu, Tonga: Fua Amotu International",0.0,0.0,
15145,"Tabriz, Iran: Tabriz International",0.0,0.0,
15146,"Tennant Creek, Australia: Tennant Creek Airport",0.0,0.0,
15147,"Treasure Cay, The Bahamas: Treasure Cay Airport",0.0,0.0,
15148,"Tucumcari, NM: Tucumcari Municipal",0.0,0.0,
15149,"Tulcea, Romania: Tulcea Airport",0.0,0.0,
15150,"Tocoa, Honduras: Tocoa Airport",0.0,0.0,
15151,"Tchibanga, Gabon: Tchibanga Airport",0.0,0.0,
15152,"Tenerife, Spain: Tenerife Metropolitan Area",0.0,0.0,
15153,"Tuscaloosa, AL: Tuscaloosa National",0.0,0.0,
15154,"Tacoma, WA: McChord Field",0.0,0.0,
15155,"Tehuacan, Mexico: Tehuacan Airport",0.0,0.0,
15156,"Tumaco, Colombia: La Florida",0.0,0.0,
15157,"Taba, Egypt: Taba International",0.0,0.0,
15158,"Tacna, Peru: Coronel Carlos Ciriani Santa Rosa International",0.0,0.0,
15159,"Truth Or Consequences, NM: Truth Or Consequences Municipal",0.0,0.0,
15160,"Takotna, AK: Takotna Airport",16.0,57.0,AK
15161,"Trinidad, Colombia: San Luis de Palenque",0.0,0.0,
15162,"Trinidad, Bolivia: Tte Av Jorge Henrich Arauz International",0.0,0.0,
15163,"Roxboro, NC: Raleigh Regional at Person County",0.0,0.0,
15164,"Amarillo, TX: Tradewind",0.0,0.0,
15165,"Toledo, OH: Metcalf Field",0.0,0.0,
15166,"Tela, Honduras: Tela Airport",0.0,0.0,
15167,"Teterboro, NJ: Teterboro Airport",0.0,0.0,
15168,"Thisted, Denmark: Thisted Airport",0.0,0.0,
15170,"Tetlin, AK: Tetlin Airport",0.0,0.0,
15171,"Tatitlek, AK: Tatitlek Airport",9.0,42.0,AK
15173,"Teptep, Papua New Guinea: Teptep Airport",0.0,0.0,
15174,"Lajes, Portugal: Lajes Airport",0.0,0.0,
15175,"Tete, Mozambique: Tete Chingodzi",0.0,0.0,
15176,"Te Anau, New Zealand: Te Anau Airport",0.0,0.0,
15177,"Telluride, CO: Telluride Regional",16.0,56.0,CO
15178,"Tezpur, India: Tezpur Airport",0.0,0.0,
15179,"Tefe, Brazil: Prefeito Orlando Marinho",0.0,0.0,
15180,"Tufi, Papua New Guinea: Tufi Airport",0.0,0.0,
15181,"Tenerife, Spain: Tenerife Norte",0.0,0.0,
15182,"Tarbes/Lourdes/Pyrenees, France: Tarbes-Lourdes-Pyrenees",0.0,0.0,
15183,"Tenerife, Spain: Tenerife Sur",0.0,0.0,
15184,"Podgorica, Montenegro: Podgorica Airport",0.0,0.0,
15185,"Tuskegee, AL: Sharpe Field",0.0,0.0,
15186,"Kuala Trengganu, Malaysia: Kuala Trengganu Airport",0.0,0.0,
15187,"Tongoa, Vanuatu: Tongoa Airport",0.0,0.0,
15188,"Tingo Maria, Peru: Tingo Maria Airport",0.0,0.0,
15189,"Targu Mures, Romania: Targu Mures Airport",0.0,0.0,
15190,"Touggourt, Algeria: Touggourt/Sidi Mahdi",0.0,0.0,
15191,"Tanga, Tanzania: Tanga Airport",0.0,0.0,
15192,"Tegucigalpa, Honduras: Toncontin International",0.0,0.0,
15194,"Tuxtla Gutierrez, Mexico: Francisco Sarabia",0.0,0.0,
15195,"Tullahoma, TN: Tullahoma Regional Airport/William Northern Field",0.0,0.0,
15196,"Teresina, Brazil: Senador Petronio Portella",0.0,0.0,
15197,"Berlin, Germany: Tempelhof",0.0,0.0,
15198,"Biloela, Australia: Biloela (Thangool)",0.0,0.0,
15199,"Trollhattan, Sweden: Trollhattan Vanersborg",0.0,0.0,
15200,"Thermopolis, WY: Hot Springs County Thermopolis Municipal",0.0,0.0,
15201,"Tehran, Iran: Mehrabad International",0.0,0.0,
15202,"Thule, Greenland: Thule Air Base",0.0,0.0,
15203,"York, PA: York Airport",0.0,0.0,
15204,"Tahoua, Niger: Tahoua Airport",0.0,0.0,
15205,"Tirana, Albania: Tirana International",0.0,0.0,
15206,"Turiacu, Brazil: Turiacu Airport",0.0,0.0,
15207,"Tippi, Ethiopia: Tippi Airport",0.0,0.0,
15208,"Taif, Saudi Arabia: Taif International",0.0,0.0,
15209,"Tikehau, French Polynesia: Tikehau Airport",0.0,0.0,
15210,"Tijuana, Mexico: Tijuana International",0.0,0.0,
15211,"Oklahoma City, OK: Tinker AFB",0.0,0.0,
15212,"Tembagapura, Indonesia: Mozes Kilangin",0.0,0.0,
15213,"Tindouf, Algeria: Tindouf Airport",0.0,0.0,
15214,"Tripoli, Libya: Tripoli International",0.0,0.0,
15215,"Tinian, TT: Tinian International",280.0,892.0,TT
15216,"Tirupati, India: Tirupati Airport",0.0,0.0,
15217,"Thursday Island, Australia: Horn Island",0.0,0.0,
15218,"Timaru, New Zealand: Timaru Airport",0.0,0.0,
15219,"Tivat, Montenegro: Tivat Airport",0.0,0.0,
15220,"Tacoma, WA: Tacoma Narrows",0.0,0.0,
15221,"Titusville, FL: Space Coast Regional",0.0,0.0,
15222,"Tidjikja, Mauritania: Tidjikja Airport",0.0,0.0,
15223,"Tari, Papua New Guinea: Tari Airport",0.0,0.0,
15224,"Tarija, Bolivia: Cap Av Oriel Lea Plaza International",0.0,0.0,
15225,"Trujillo, Honduras: Trujillo Airport",0.0,0.0,
15226,"Tyumen, Russia: Roshchino",0.0,0.0,
15227,"Ankara, Turkey: Murted",0.0,0.0,
15228,"Talkeetna, AK: Talkeetna Airport",0.0,0.0,
15229,"Tiko, Cameroon: Tiko Airport",0.0,0.0,
15230,"Takoradi, Ghana: Takoradi Airport",0.0,0.0,
15231,"Tenakee, AK: Tenakee Airport",35.0,68.0,AK
15232,"Truckee, CA: Truckee Tahoe",16.0,54.0,CA
15233,"Bandar Lampung, Indonesia: Branti",0.0,0.0,
15234,"Takhli, Thailand: Takhli Airport",0.0,0.0,
15235,"Tokeen, AK: Tokeen Airport",0.0,0.0,
15236,"Tok, AK: Tok Junction",28.0,14.0,AK
15237,"Chuuk, Federated States of Micronesia: Chuuk International",0.0,0.0,
15238,"Taku Lodge, AK: Taku Seaplane Base",0.0,0.0,
15239,"Tikal, Guatemala: Tikal Airport",0.0,0.0,
15240,"Kigoma, Tanzania: Kigoma Airport",0.0,0.0,
15241,"Thakurgaon, Bangladesh: Thakurgaon Stol Port",0.0,0.0,
15242,"Tokushima, Japan: Tokushima Airport",0.0,0.0,
15243,"Tak, Thailand: Tak Airport",0.0,0.0,
15244,"Turku, Finland: Turku Airport",0.0,0.0,
15245,"Teller, AK: Teller Airport",41.0,78.0,AK
15246,"Toluca, Mexico: Toluca International",0.0,0.0,
15247,"Tulear, Madagascar: Tulear Airport",0.0,0.0,
15248,"Telida, AK: Telida Airport",0.0,0.0,
15249,"Tallahassee, FL: Tallahassee International",233.0,8165.0,FL
15250,"Tatalina, AK: Tatalina LRRS",9.0,34.0,AK
15252,"Tallinn, Estonia: Lennart Meri Tallinn",0.0,0.0,
15253,"Tlemcen, Algeria: Zenata-Messali El Hadj",0.0,0.0,
15254,"Toulon/Hyeres, France: Hyeres Le Palyvestre",0.0,0.0,
15255,"Tulare, CA: Mefford Field",0.0,0.0,
15256,"Toulouse, France: Toulouse Blagnac",0.0,0.0,
15257,"Tuluksak, AK: Tuluksak Airport",53.0,74.0,AK
15258,"Tel Aviv, Israel: Ben Gurion",0.0,0.0,
15259,"Tifton, GA: Henry Tift Myers",0.0,0.0,
15260,"Miami, FL: Miami Executive",0.0,0.0,
15261,"Timbedra, Mauritania: Timbedra Airport",0.0,0.0,
15262,"Tumlingtar, Nepal: Tumlingtar Airport",0.0,0.0,
15263,"Tamale, Ghana: Tamale Airport",0.0,0.0,
15264,"Tamatave, Madagascar: Toamasina",0.0,0.0,
15265,"Tampere, Finland: Tampere-Pirkkala",0.0,0.0,
15266,"Tamanrasset, Algeria: Aguemar",0.0,0.0,
15267,"Sao Tome Island, Sao Tome and Principe: Salazar",0.0,0.0,
15268,"Trombetas, Brazil: Trombetas Airport",0.0,0.0,
15269,"Tamworth, Australia: Tamworth Airport",0.0,0.0,
15270,"Lebanon, TN: Lebanon Municipal",0.0,0.0,
15271,"Sparta, TN: Upper Cumberland Regional",0.0,0.0,
15272,"Lewisburg, TN: Ellington",0.0,0.0,
15273,"Pulaski, TN: Abernathy Field",0.0,0.0,
15274,"Lexington, TN: Franklin Wilkins",0.0,0.0,
15275,"Dyersburg, TN: Dyersburg Regional",0.0,0.0,
15276,"Winchester, TN: Winchester Municipal",0.0,0.0,
15277,"Jinan, China: Yaoqiang",0.0,0.0,
15278,"Tin City, AK: Tin City LRRS",2.0,2.0,AK
15279,"Tanegashima, Japan: Tanegashima Airport",0.0,0.0,
15280,"Tangier, Morocco: Tanger Ibn Batouta International",0.0,0.0,
15281,"Tandjungpinang, Indonesia: Kidjang",0.0,0.0,
15282,"Tununak, AK: Tununak Airport",81.0,89.0,AK
15283,"Tainan, Taiwan: Tainan Airport",0.0,0.0,
15284,"Twentynine Palms, CA: Twentynine Palms Airport",0.0,0.0,
15285,"Antananarivo, Madagascar: Ivato",0.0,0.0,
15286,"Miami, FL: Dade-Collier Training and Transition",0.0,0.0,
15287,"Newton, IA: Newton Municipal Earl Johnson Field",0.0,0.0,
15288,"Stung Treng, Cambodia: Stung Treng Airport",0.0,0.0,
15289,"Torrance, CA: Zamperini Field",0.0,0.0,
15290,"Tobruk, Libya: Tobruk Airport",0.0,0.0,
15292,"Tozeur, Tunisia: Nefta",0.0,0.0,
15293,"Togiak, AK: Togiak Airport",31.0,78.0,AK
15294,"Madrid, Spain: Torrejon AFB",0.0,0.0,
15295,"Toledo, OH: Eugene F Kranz Toledo Express",77.0,4002.0,OH
15296,"Tombouctou, Mali: Tombouctou Airport",0.0,0.0,
15297,"Topeka, KS: Philip Billard Municipal",0.0,0.0,
15298,"Tocopilla, Chile: Barriles",0.0,0.0,
15299,"Torrington, WY: Torrington Municipal",0.0,0.0,
15300,"Tromso, Norway: Langnes",0.0,0.0,
15301,"Touho, New Caledonia: Touho Airport",0.0,0.0,
15302,"Tortola, British Virgin Islands: Tortola West End Seaplane Base",0.0,0.0,
15303,"Toyama, Japan: Toyama Airport",0.0,0.0,
15304,"Tampa, FL: Tampa International",2591.0,241538.0,FL
15305,"Topeka, KS: Allen Air Park",0.0,0.0,
15306,"Taipei, Taiwan: Taiwan Taoyuan International",0.0,0.0,
15307,"Tampa, FL: Peter O'Knight",0.0,0.0,
15308,"Tonopah, NV: Tonopah Airport",0.0,0.0,
15309,"Tapini, Papua New Guinea: Tapini Airport",0.0,0.0,
15310,"Temple, TX: Draughon-Miller Central Texas Regional",0.0,0.0,
15312,"Tarapoto, Peru: Tarapoto Airport",0.0,0.0,
15313,"Tepic, Mexico: Tepic International",0.0,0.0,
15314,"Tom Price, Australia: Tom Price Airport",0.0,0.0,
15315,"Trapani/Marsala, Italy: Trapani/Birgi",0.0,0.0,
15316,"Turbo, Colombia: Turbo Airport",0.0,0.0,
15317,"Torreon, Mexico: Torreon International",0.0,0.0,
15318,"Trondheim, Norway: Trondheim Airport",0.0,0.0,
15319,"Tiree Island, United Kingdom: Tiree Island Airport",0.0,0.0,
15320,"Sandefjord, Norway: Torp",0.0,0.0,
15321,"Tauranga, New Zealand: Tauranga Airport",0.0,0.0,
15322,"Trona, CA: Trona Airport",0.0,0.0,
15323,"Bristol/Johnson City/Kingsport, TN: Tri Cities",141.0,5109.0,TN
15324,"Tarakan, Indonesia: Juwata",0.0,0.0,
15325,"Thermal, CA: Jacqueline Cochran Regional",0.0,0.0,
15326,"Turin, Italy: Torino",0.0,0.0,
15327,"Taree, Australia: Taree Airport",0.0,0.0,
15328,"Trincomalee, Sri Lanka: China Bay",0.0,0.0,
15329,"Trieste, Italy: Trieste Airport",0.0,0.0,
15331,"Trujillo, Peru: Cap FAP Carlos Martinez de Pinillos",0.0,0.0,
15332,"Trivandrum, India: Thiruvananthapuram International",0.0,0.0,
15333,"Tarawa, Kiribati: Bonriki International",0.0,0.0,
15334,"Trichinopoly, India: Tiruchirappalli International",0.0,0.0,
15335,"Taipei, Taiwan: Taipei Songshan",0.0,0.0,
15336,"Tsumeb, Namibia: Tsumeb Airport",0.0,0.0,
15337,"Astana, Kazakhstan: Nursultan Nazarbayev International",0.0,0.0,
15338,"Venice, Italy: Treviso",0.0,0.0,
15339,"Tanacross, AK: Tanacross Airport",0.0,0.0,
15340,"Tshikapa, Congo (Kinshasa): Tshikapa Airport",0.0,0.0,
15341,"Tsushima, Japan: Tsushima Airport",0.0,0.0,
15342,"Taos, NM: Taos Regional",0.0,0.0,
15343,"Tianjin, China: Tianjin Binhai International",0.0,0.0,
15344,"Tehachapi, CA: Tehachapi Municipal",0.0,0.0,
15345,"Timisoara, Romania: Traian Vuia",0.0,0.0,
15346,"New York, NY: East 34th Street Heliport",0.0,0.0,
15348,"Townsville, Australia: Townsville International",0.0,0.0,
15349,"Tortoli, Italy: Tortoli Arbatax",0.0,0.0,
15350,"Taltal, Chile: Argolla",0.0,0.0,
15351,"Troutdale, OR: Portland Troutdale",0.0,0.0,
15352,"Tartagal, Argentina: Tartagal Airport",0.0,0.0,
15353,"Thumrait, Oman: Thumrait Airport",0.0,0.0,
15354,"Tottori, Japan: Tottori Airport",0.0,0.0,
15355,"Turtle Island, Fiji: Turtle Island Airport",0.0,0.0,
15356,"Trenton, NJ: Trenton Mercer",39.0,4237.0,NJ
15358,"Tsaratanana, Madagascar: Tsaratanana Airport",0.0,0.0,
15359,"Taitung, Taiwan: Fongnian",0.0,0.0,
15360,"Tetuan, Morocco: Tetouan/Sania Ramel",0.0,0.0,
15361,"Tulcan, Ecuador: Tulcan Airport",0.0,0.0,
15362,"Tubuai Island, French Polynesia: Tubuai Is Fr. Polynesia",0.0,0.0,
15363,"Tucuman, Argentina: Tucuman Airport",0.0,0.0,
15364,"Tambacounda, Senegal: Tambacounda Airport",0.0,0.0,
15365,"Tours, France: Tours Val de Loire",0.0,0.0,
15366,"Tuguegarao, Philippines: Tuguegarao Airport",0.0,0.0,
15367,"Tullahoma, TN: Arnold AFB",0.0,0.0,
15368,"Turaif, Saudi Arabia: Turaif Airport",0.0,0.0,
15369,"Turbat, Pakistan: Turbat International",0.0,0.0,
15370,"Tulsa, OK: Tulsa International",549.0,38768.0,OK
15371,"Tumut, Australia: Tumut Airport",0.0,0.0,
15372,"Tunis, Tunisia: Carthage",0.0,0.0,
15373,"Taupo, New Zealand: Taupo Airport",0.0,0.0,
15374,"Tupelo, MS: Tupelo Regional",77.0,536.0,MS
15375,"Tucurui, Brazil: Tucurui Airport",0.0,0.0,
15376,"Tucson, AZ: Tucson International",686.0,42071.0,AZ
15377,"Tauta, Papua New Guinea: Tauta Airport",0.0,0.0,
15378,"Tabuk, Saudi Arabia: Prince Sultan Bin Abdulaziz",0.0,0.0,
15379,"Morafenobe, Madagascar: Morafenobe Airport",0.0,0.0,
15380,"Traverse City, MI: Cherry Capital",165.0,6157.0,MI
15381,"Thief River Falls, MN: Thief River Falls Regional",52.0,93.0,MN
15382,"Thomasville, GA: Thomasville Regional",0.0,0.0,
15383,"Lake Tahoe, CA: Lake Tahoe Airport",0.0,0.0,
15384,"Taveuni, Fiji: Matei",0.0,0.0,
15385,"Twin Hills, AK: Twin Hills Airport",22.0,45.0,AK
15386,"Toowoomba, Australia: Toowoomba Airport",0.0,0.0,
15387,"Port Townsend, WA: Jefferson County International",0.0,0.0,
15388,"Taylor, AK: Taylor Airport",0.0,0.0,
15389,"Twin Falls, ID: Joslin Field - Magic Valley Regional",22.0,611.0,ID
15390,"Two Harbors, CA: Two Harbors Airport",0.0,0.0,
15392,"Tawau, Malaysia: Tawau Airport",0.0,0.0,
15393,"Mesquite, TX: Mesquite Metro",0.0,0.0,
15394,"Denver City, TX: Denver City Airport",0.0,0.0,
15395,"Port Isabel, TX: Port Isabel - Cameron County",0.0,0.0,
15396,"Ballinger, TX: Bruce Field",0.0,0.0,
15397,"Cleburne, TX: Cleburne Regional",0.0,0.0,
15398,"Horseshoe Bay, TX: Horseshoe Bay Resort",0.0,0.0,
15399,"Post, TX: Post Garza County Municipal",0.0,0.0,
15400,"Taichung, Taiwan: Taichung Airport",0.0,0.0,
15401,"Texarkana, AR: Texarkana Regional-Webb Field",33.0,947.0,AR
15402,"Berlin, Germany: Tegel",0.0,0.0,
15403,"Tunxi, China: Tunxi Airport",0.0,0.0,
15404,"Tabou, Cote d'Ivoire: Tabou Airport",0.0,0.0,
15405,"Tibooburra, Australia: Tibooburra Airport",0.0,0.0,
15406,"Tyonek, AK: Tyonek Airport",0.0,0.0,
15408,"Talara, Peru: Capitan FAP Victor Montes International",0.0,0.0,
15409,"Taiyuan, China: Wusu",0.0,0.0,
15410,"Tokyo, Japan: Tokyo Metropolitan Area",0.0,0.0,
15411,"Tyler, TX: Tyler Pounds Regional",60.0,1722.0,TX
15412,"Knoxville, TN: McGhee Tyson",602.0,33522.0,TN
15413,"Taylor, AZ: Taylor Airport",0.0,0.0,
15414,"Belize City, Belize: Belize Municipal",0.0,0.0,
15415,"Maya Beach, Belize: Maya Beach Airport",0.0,0.0,
15416,"Tuzla, Bosnia and Herzegovina: Tuzla Airport",0.0,0.0,
15417,"South Andos, The Bahamas: Congo Town",0.0,0.0,
15418,"Trabzon, Turkey: Trabzon Airport",0.0,0.0,
15419,"Adana, Turkey: Incirlik AB",0.0,0.0,
15420,"Ua Huka, French Polynesia: Ua Huka Airport",0.0,0.0,
15421,"Narsarsuaq, Greenland: Narsarsuaq Airport",0.0,0.0,
15422,"Guam, TT: Andersen AFB",0.0,0.0,
15423,"San Juan, Argentina: San Juan Airport",0.0,0.0,
15424,"Samburu, Kenya: Samburu Airport",0.0,0.0,
15425,"Uaxactun, Guatemala: Uaxactun Airport",0.0,0.0,
15426,"Uberaba, Brazil: Mario de Almeida Franco",0.0,0.0,
