ORIGIN_AIRPORT_ID,NAME,DEPARTURES_PERFORMED,PASSENGERS,ORIGIN_STATE_ABR
13446,"Mt. Pocono, PA: Pocono Mountains Regional",0.0,0.0,
13447,"McPherson, KS: McPherson Airport",0.0,0.0,
13448,"Mount Pleasant, TX: Mount Pleasant Municipal",0.0,0.0,
13449,"Maliana, Timor-Leste: Maliana Airport",0.0,0.0,
13450,"Montpelier/Barre, VT: Edward F Knapp State",0.0,0.0,
13451,"Miyanmin, Papua New Guinea: Miyanmin Airport",0.0,0.0,
13452,"Macomb, IL: Macomb Municipal",0.0,0.0,
13453,"Indianapolis, IN: Indianapolis Regional",0.0,0.0,
13454,"Mildura, Australia: Mildura Airport",0.0,0.0,
13455,"Mo I Rana, Norway: Rossvoll",0.0,0.0,
13456,"Nelspruit, South Africa: Kruger Mpumalanga International",0.0,0.0,
13457,"Moundou, Chad: Moundou Airport",0.0,0.0,
13458,"Mustique, Saint Vincent and the Grenadines: Mustique Airport",0.0,0.0,
13459,"Marquette, MI: Sawyer International",43.0,1097.0,MI
13460,"Mek'ele, Ethiopia: Mekele International",0.0,0.0,
13461,"Smyrna, TN: Smyrna Airport",0.0,0.0,
13462,"Misurata, Libya: Misrata International",0.0,0.0,
13463,"Martinsburg, WV: Eastern WV Regional/Shepherd Field",0.0,0.0,
13464,"Columbia, TN: Maury County Regional",0.0,0.0,
13465,"Merida, Venezuela: Alberto Carnevalli",0.0,0.0,
13466,"Morehead City, NC: Beaufort Morehead City",0.0,0.0,
13467,"Anchorage, AK: Merrill Field",28.0,122.0,AK
13469,"Marco Island, FL: Marco Island Executive",0.0,0.0,
13470,"Morganton, NC: Morganton Lenoir",0.0,0.0,
13471,"Grand Case, Saint Martin: Grand Case Airport",0.0,0.0,
13472,"Marseille, France: Marseille Provence",0.0,0.0,
13473,"Mauritius Island, Mauritius: Sir Seewoosagur Ramgoolam International",0.0,0.0,
13474,"Mineralnyye Vody, Russia: Mineralnyye Vody Airport",0.0,0.0,
13475,"Margarita Island, Venezuela: Del Caribe International",0.0,0.0,
13476,"Monterey, CA: Monterey Regional",103.0,3473.0,CA
13477,"Moree, Australia: Moree Airport",0.0,0.0,
13478,"Grenada, MS: Grenada Municipal",0.0,0.0,
13479,"Muskrat Dam, Canada: Muskrat Dam Airport",0.0,0.0,
13480,"Mesa, AZ: Falcon Field",0.0,0.0,
13481,"Manston, United Kingdom: Manston Airport",0.0,0.0,
13482,"Masirah, Oman: Masirah Airport",0.0,0.0,
13483,"Misawa, Japan: Misawa AB",0.0,0.0,
13484,"Muscle Shoals, AL: Northwest Alabama Regional",103.0,190.0,AL
13485,"Madison, WI: Dane County Regional-Truax Field",298.0,12324.0,WI
13486,"Missoula, MT: Missoula Montana",219.0,10926.0,MT
13487,"Minneapolis, MN: Minneapolis-St Paul International",3774.0,203484.0,MN
13488,"Minsk, Belarus: Minsk 2",0.0,0.0,
13490,"Massena, NY: Massena International-Richards Field",88.0,80.0,NY
13491,"Maastricht, Netherlands: Maastricht Aachen",0.0,0.0,
13492,"Maseru, Lesotho: Moshoeshoe I International",0.0,0.0,
13493,"Monticello, NY: Sullivan County International",0.0,0.0,
13494,"Massawa, Eritrea: Massawa International",0.0,0.0,
13495,"New Orleans, LA: Louis Armstrong New Orleans International",1386.0,102322.0,LA
13496,"Namibe, Angola: Yuri Gagarin",0.0,0.0,
13497,"Colstrip, MT: Colstrip Airport",0.0,0.0,
13498,"Mt. Clemens, MI: Selfridge Angb",0.0,0.0,
13499,"Mt. Sandford, Australia: Mount Sanford Station",0.0,0.0,
13500,"Monte Alegre, Brazil: Monte Alegre Airport",0.0,0.0,
13501,"Marathon, FL: The Florida Keys Marathon International",0.0,0.0,
13502,"Montrose/Delta, CO: Montrose Regional",97.0,3213.0,CO
13503,"Maitland, Australia: Maitland Airport",0.0,0.0,
13504,"Metlakatla, AK: Metlakatala",60.0,21.0,AK
13505,"Baltimore, MD: Martin State",0.0,0.0,
13506,"Mattoon/Charleston, IL: Coles County Memorial",0.0,0.0,
13507,"Montauk Point, NY: Sky Portal",0.0,0.0,
13508,"Monteria, Colombia: Los Garzones",0.0,0.0,
13509,"Manzini, Swaziland: Matsapha",0.0,0.0,
13510,"Minatitlan, Mexico: Minatitlan Airport",0.0,0.0,
13511,"Mota Lava, Vanuatu: Mota Lava Airport",0.0,0.0,
13512,"Manitowoc, WI: Manitowoc County",0.0,0.0,
13513,"Fairbanks, AK: Metro Field",0.0,0.0,
13514,"Monterrey, Mexico: Monterrey International",0.0,0.0,
13515,"Masada, Israel: Israel Bar Yehuda",0.0,0.0,
13516,"Munda, Solomon Islands: Munda Airport",0.0,0.0,
13517,"Maun, Botswana: Maun Airport",0.0,0.0,
13518,"Munich, Germany: Muenchen",0.0,0.0,
13520,"Kamuela, HI: Waimea-Kohala",57.0,255.0,HI
13521,"Mulege, Mexico: Mulege Airport",0.0,0.0,
13522,"Mersa Matruh, Egypt: Mersa Matruh Airport",0.0,0.0,
13523,"Moultrie, GA: Spence",0.0,0.0,
13524,"Maturin, Venezuela: Jose Tadeo Monagas International",0.0,0.0,
13525,"Mountain Home, ID: Mountain Home AFB",0.0,0.0,
13526,"Marudi, Malaysia: Marudi Airport",0.0,0.0,
13527,"Muscatine, IA: Muscatine Municipal",0.0,0.0,
13528,"Multan, Pakistan: Multan International",0.0,0.0,
13530,"Musoma, Tanzania: Musoma Airport",0.0,0.0,
13531,"Mvengue, Gabon: Mvengue Airport",0.0,0.0,
13532,"Montevideo, Uruguay: Carrasco International",0.0,0.0,
13533,"Mossoro, Brazil: Dixsept Rosado",0.0,0.0,
13534,"Mandeville, Jamaica: Marlboro",0.0,0.0,
13535,"Morrisville, VT: Morrisville Stowe State",0.0,0.0,
13536,"Kayenta, AZ: Kayenta Airport",0.0,0.0,
13537,"Mount Vernon, IL: Mount Vernon Airport",0.0,0.0,
13539,"Maroua, Cameroon: Salak",0.0,0.0,
13540,"Burlington/Mount Vernon, WA: Skagit Regional",0.0,0.0,
13541,"Martha's Vineyard, MA: Martha's Vineyard Airport",265.0,805.0,MA
13543,"Marion/Herrin, IL: Veterans Airport of Southern Illinois",155.0,357.0,IL
13544,"Milwaukee, WI: Lawrence J Timmerman",0.0,0.0,
13545,"Mianwali, Pakistan: Mianwali Airport",0.0,0.0,
13546,"Moses Lake, WA: Grant County International",0.0,0.0,
13547,"Mineral Wells, TX: Mineral Wells Regional",0.0,0.0,
13548,"Windom, MN: Windom Municipal",0.0,0.0,
13549,"Middletown, OH: Middletown Regional/Hook Field",0.0,0.0,
13550,"Magwe, Burma: Magway",0.0,0.0,
13551,"Mwanza, Tanzania: Mwanza Airport",0.0,0.0,
13552,"Masamba, Indonesia: Andi Jemma",0.0,0.0,
13553,"Monticello, UT: Monticello Airport",0.0,0.0,
13554,"Maxton, NC: Laurinburg-Maxton",0.0,0.0,
13555,"Montgomery, AL: Maxwell AFB",0.0,0.0,
13556,"Marlboro, MA: Marlboro Airport",0.0,0.0,
13557,"Moro, Papua New Guinea: Moro Airport",0.0,0.0,
13558,"Minna, Nigeria: Minna Airport",0.0,0.0,
13559,"Mexicali, Mexico: Mexicali International",0.0,0.0,
13560,"Milan, Italy: Malpensa",0.0,0.0,
13561,"Maota, Samoa: Maota Airport",0.0,0.0,
13562,"Maintirano, Madagascar: Maintirano Airport",0.0,0.0,
13563,"Mora, Sweden: Mora Airport",0.0,0.0,
13564,"McCarthy, AK: McCarthy Airport",0.0,0.0,
13565,"Moruya, Australia: Moruya Airport",0.0,0.0,
13566,"Mayumba, Gabon: Mayumba Airport",0.0,0.0,
13567,"Maracay, Venezuela: Maracay Airport",0.0,0.0,
13568,"Malindi, Kenya: Malindi Airport",0.0,0.0,
13569,"Miyake Jima, Japan: Miyake Jima Airport",0.0,0.0,
13570,"San Diego, CA: Montgomery Gibbs Executive",0.0,0.0,
13571,"Mayaguana, The Bahamas: Mayaguana Airport",0.0,0.0,
13572,"Marble Canyon, AZ: Cliff Dwellers",0.0,0.0,
13573,"Matsuyama, Japan: Matsuyama Airport",0.0,0.0,
13574,"May Creek, AK: May Creek Airport",0.0,0.0,
13575,"McCall, ID: McCall Municipal",0.0,0.0,
13576,"Mary, Turkmenistan: Mary Airport",0.0,0.0,
13577,"Myrtle Beach, SC: Myrtle Beach International",568.0,45916.0,SC
13578,"Myitkyina, Burma: Myitkyina Airport",0.0,0.0,
13579,"Mekoryuk, AK: Mekoryuk Airport",16.0,22.0,AK
13580,"Marysville, CA: Yuba County",0.0,0.0,
13581,"Mtwara, Tanzania: Mtwara Airport",0.0,0.0,
13582,"Miri, Malaysia: Miri Airport",0.0,0.0,
13584,"Mocimboa Da Praia, Mozambique: Mocimboa Da Praia Airport",0.0,0.0,
13585,"Makung, Taiwan: Ma Kung AB",0.0,0.0,
13586,"Mopti, Mali: Ambodedjo",0.0,0.0,
13587,"Marana, AZ: Pinal Airpark",0.0,0.0,
13588,"Marakei, Kiribati: Marakei Airport",0.0,0.0,
13589,"Manizales, Colombia: La Nubia",0.0,0.0,
13590,"Metz, France: Metz-Nancy Metz-Frescaty",0.0,0.0,
13591,"Minj, Papua New Guinea: Minj Airport",0.0,0.0,
13592,"Manzanillo, Cuba: Sierra Maestra International",0.0,0.0,
13593,"Mazar-I-Sherif, Afghanistan: Mawlana Jalaluddin Muhammad Balkhi",0.0,0.0,
13594,"Mazatlan, Mexico: Mazatlan International",0.0,0.0,
13595,"Marion, IN: Marion Municipal McKinney Field",0.0,0.0,
13596,"Pottstown, PA: Pottstown Municipal",0.0,0.0,
13597,"Robbinsville, NJ: Trenton-Robbinsville",0.0,0.0,
13598,"Narrabri, Australia: Narrabri Airport",0.0,0.0,
13599,"North Adams, MA: Harriman-and-West",0.0,0.0,
13600,"Nagpur, India: Dr. Baba Saheb Ambedkar International",0.0,0.0,
13601,"Nakhon Ratchasima, Thailand: Nakhon Ratchasima Airport",0.0,0.0,
13602,"Nadi, Fiji: Nadi International",0.0,0.0,
13603,"Nanchong, China: Nanchong Airport",0.0,0.0,
13604,"Naples, Italy: Capodichino",0.0,0.0,
13605,"Nassau, The Bahamas: Lynden Pindling International",0.0,0.0,
13606,"Natal, Brazil: Campo Augusto Severo",0.0,0.0,
13607,"Napuka Islnd, French Polynesia: Napuka",0.0,0.0,
13609,"Star Harbour, Solomon Islands: Nana",0.0,0.0,
13610,"Nambaiyufa, Papua New Guinea: Nambaiyufa Airport",0.0,0.0,
13611,"Naberevnye Chelny, Russia: Begishevo",0.0,0.0,
13612,"New Orleans, LA: New Orleans NAS JRB",0.0,0.0,
13613,"Newburgh, NY: Newburgh Airport",0.0,0.0,
13614,"Bangkok, Thailand: Suvarnabhumi International",0.0,0.0,
13616,"Nairobi, Kenya: Nairobi Jomo Kenyatta International",0.0,0.0,
13617,"Glenview, IL: Glenview NAS",0.0,0.0,
13618,"Guantanamo, Cuba: Guantanamo Bay NS",0.0,0.0,
13619,"Gastonia, NC: Gastonia Municipal",0.0,0.0,
13620,"Smithfield, NC: Johnston Regional",0.0,0.0,
13621,"Shelby, NC: Shelby-Cleveland County Regional",0.0,0.0,
13622,"Currituck, NC: Currituck County Regional",0.0,0.0,
13623,"Kenansville, NC: Duplin County",0.0,0.0,
13624,"North Caicos, Turks and Caicos Islands: North Caicos International",0.0,0.0,
13625,"Nice, France: Nice Cote D Azur",0.0,0.0,
13626,"Nachingwea, Tanzania: Nachingwea Airport",0.0,0.0,
13627,"Necocli, Colombia: Necocli Airport",0.0,0.0,
13628,"Newcastle, United Kingdom: Newcastle Airport",0.0,0.0,
13629,"Chenega, AK: Chenega Bay",0.0,0.0,
13630,"North Kingstown, RI: Quonset State Air Reserve National Guard Helipad",0.0,0.0,
13631,"Subic Bay, Philippines: Cubi Point NAS",0.0,0.0,
13632,"Marietta, GA: Dobbins ARB",0.0,0.0,
13633,"Newcastle, South Africa: Newcastle Airport",0.0,0.0,
13634,"Nicoya, Costa Rica: Miguel Angel Castillo Zumbado",0.0,0.0,
13635,"Nukus, Uzbekistan: Nukus Airport",0.0,0.0,
13636,"Annecy, France: Annecy Meythet",0.0,0.0,
13637,"Kindred, ND: Robert Odegaard Field",0.0,0.0,
13638,"Nouadhibou, Mauritania: Nouadhibou Airport",0.0,0.0,
13639,"Nanded, India: Nanded Airport",0.0,0.0,
13641,"Ndjamena, Chad: Hassan Djamous",0.0,0.0,
13642,"Ndele, Central African Republic: Ndele Airport",0.0,0.0,
13643,"Nador, Morocco: El Aroui International",0.0,0.0,
13644,"Cuxhaven, Germany: Nordholz-Spieka",0.0,0.0,
13645,"Gothenburg, NE: Gothenburg Municipal",0.0,0.0,
13646,"Blair, NE: Blair Exec",0.0,0.0,
13647,"Brunswick, GA: Glynco NAS",0.0,0.0,
13648,"Negril, Jamaica: Negril Airport",0.0,0.0,
13650,"Lakehurst, NJ: Lakehurst/Maxfield Field",0.0,0.0,
13651,"Neryungri, Russia: Neryungri Airport",0.0,0.0,
13652,"New Bight, The Bahamas: New Bight Airport",0.0,0.0,
13653,"Sam Neua, Laos: Samneua",0.0,0.0,
13654,"Nevis, Saint Kitts and Nevis: Vance Winkworth Amory",0.0,0.0,
13655,"New Orleans, LA: Lakefront",0.0,0.0,
13656,"Fallon, NV: Fallon NAS",0.0,0.0,
13657,"Young, Australia: Young Airport",0.0,0.0,
13658,"Ningbo, China: Ningbo Lishe International",0.0,0.0,
13659,"Grand Canyon, AZ: North Rim",0.0,0.0,
13660,"Anegada, British Virgin Islands: Auguste George",0.0,0.0,
13661,"N'Gaoundere, Cameroon: N'Gaoundere Airport",0.0,0.0,
13662,"Kaneohe, HI: Kaneohe Bay MCAS",0.0,0.0,
13663,"Guam, TT: Agana NAS",0.0,0.0,
13664,"Nagoya, Japan: Nagoya Airport",0.0,0.0,
13665,"Corpus Christi, TX: Corpus Christi NAS",0.0,0.0,
13666,"Nagasaki, Japan: Nagasaki Airport",0.0,0.0,
13667,"Norfolk, VA: Norfolk NS",0.0,0.0,
13668,"Alameda, CA: Alameda NAS",0.0,0.0,
13669,"Nha-Trang, Vietnam: Nha Trang",0.0,0.0,
13670,"Dubai, United Arab Emirates: Minhad AB",0.0,0.0,
13671,"Patuxent River, MD: Patuxent River NAS",0.0,0.0,
13672,"Northolt, United Kingdom: RAF Northolt",0.0,0.0,
13673,"Nuku Hiva, French Polynesia: Nuku Hiva Fr.Poly.",0.0,0.0,
13674,"Brunswick, ME: Brunswick Executive",0.0,0.0,
13675,"Nimba, Liberia: Nimba Airport",0.0,0.0,
13676,"Nikolai, AK: Nikolai Airport",27.0,125.0,AK
13677,"Nicosia, Cyprus: Nicosia Airport",0.0,0.0,
13678,"Niblack, AK: Niblack Airport",0.0,0.0,
13679,"Nikunau, Kiribati: Nikunau Airport",0.0,0.0,
13680,"Niamey, Niger: Diori Hamani",0.0,0.0,
13681,"Ninilchik, AK: Ninilchik Airport",0.0,0.0,
13682,"Jacksonville, FL: Jacksonville NAS",0.0,0.0,
13683,"Niort, France: Niort Airport",0.0,0.0,
13684,"Nioro, Mali: Nioro Airport",0.0,0.0,
13685,"Berlin, NJ: Camden County",0.0,0.0,
13686,"West Creek, NJ: Eagles Nest",0.0,0.0,
13687,"Atsugi, Japan: Atsugi NAF",0.0,0.0,
13688,"Nizhnevartovsk, Russia: Nizhnevartovsk Airport",0.0,0.0,
13689,"El Centro, CA: El Centro NAF",0.0,0.0,
13690,"Nkan, Gabon: Nkan Airport",0.0,0.0,
13691,"Nouakchott, Mauritania: Nouakchott Airport",0.0,0.0,
13692,"Nanjing, China: Lukou",0.0,0.0,
13693,"Naukiti, AK: Naukiti Airport",10.0,16.0,AK
13694,"Nagoya, Japan: Chubu Centrair International",0.0,0.0,
13695,"Nankina, Papua New Guinea: Nankina Airport",0.0,0.0,
13696,"Nkongsamba, Cameroon: Nkongsamba Airport",0.0,0.0,
13697,"Cherry Point, NC: Cherry Point MCAS",0.0,0.0,
13698,"Nichen Cove, AK: Nichin Cove Seaplane Base",0.0,0.0,
13699,"Diego Garcia, British Indian Ocean Territory: Diego Garcia Nsf",0.0,0.0,
13700,"San Diego, CA: Miramar MCAS",0.0,0.0,
13701,"Ndola, Zambia: Ndola Airport",0.0,0.0,
13702,"Lemoore, CA: Lemoore NAS",0.0,0.0,
13703,"Nuevo Laredo, Mexico: Nuevo Laredo Airport",0.0,0.0,
13704,"Nelson Lagoon, AK: Nelson Lagoon Airport",13.0,1.0,AK
13705,"Norfolk Island, Australia: Norfolk Island Airport",0.0,0.0,
13706,"Kinshasa, Congo (Kinshasa): N'Dolo",0.0,0.0,
13707,"Nelspruit, South Africa: Nelspruit Airport",0.0,0.0,
13708,"Nicholson, Australia: Nicholson Station",0.0,0.0,
13709,"Norman's Cay, The Bahamas: Norman's Cay Airport",0.0,0.0,
13710,"Nightmute, AK: Nightmute Airport",71.0,126.0,AK
13711,"San Miguel, Panama: San Miguel Airport",0.0,0.0,
13712,"Kenitra, Morocco: Kenitra Airport",0.0,0.0,
13713,"Nanning, China: Nanning Wuxu International",0.0,0.0,
13714,"Naknek, AK: Naknek Airport",0.0,0.0,
13715,"Nondalton, AK: Nondalton Airport",16.0,9.0,AK
13716,"Nanuque, Brazil: Nanuque Airport",0.0,0.0,
13717,"Nanyang, China: Nanyang East",0.0,0.0,
13718,"Nowra, Australia: Nowra Airport",0.0,0.0,
13719,"Connaught, Ireland: Ireland West Airport Knock",0.0,0.0,
13720,"Nogales, Mexico: Nogales International",0.0,0.0,
13721,"Nonouti, Kiribati: Nonouti Airport",0.0,0.0,
13722,"Mactan Island, Philippines: Nab",0.0,0.0,
13723,"Nordfjordur, Iceland: Nordfjordur Airport",0.0,0.0,
13724,"Nossi-Be, Madagascar: Fascene",0.0,0.0,
13725,"Novato, CA: Gnoss Field",0.0,0.0,
13726,"Noumea, New Caledonia: Noumea La Tontouta",0.0,0.0,
13727,"Huambo, Angola: Huambo Airport",0.0,0.0,
13728,"Pensacola, FL: Pensacola NAS",0.0,0.0,
13729,"Napier, New Zealand: Napier Airport",0.0,0.0,
13730,"New Plymouth, New Zealand: New Plymouth Airport",0.0,0.0,
13731,"Newport, RI: Newport State",0.0,0.0,
13732,"Millington, TN: Millington Memphis",0.0,0.0,
13733,"Kingsville, TX: Kingsville NAS",0.0,0.0,
13734,"Neuquen, Argentina: Presidente Peron",0.0,0.0,
13736,"Key West, FL: Key West NAS",0.0,0.0,
13737,"Newquay, United Kingdom: Newquay Airport",0.0,0.0,
13738,"Narrandera, Australia: Narrandera Airport",0.0,0.0,
13739,"Mayport, FL: Mayport NS",0.0,0.0,
13740,"Afton, OK: Grand Lake Regional",0.0,0.0,
13741,"Norrkoping, Sweden: Kungsangen",0.0,0.0,
13742,"North Ronaldsay, United Kingdom: North Ronaldsay Airport",0.0,0.0,
13743,"Ceiba, PR: Roosevelt Roads NAS",0.0,0.0,
13744,"Tokyo, Japan: Narita International",0.0,0.0,
13745,"Noosa, Australia: Noosa Aust.",0.0,0.0,
13746,"Bimini, The Bahamas: North Seaplane Base",0.0,0.0,
13747,"Milton, FL: Whiting Field NAS North",0.0,0.0,
13748,"Camp Springs, MD: Joint Base Andrews",0.0,0.0,
13749,"Yaounde, Cameroon: Yaounde Nsimalen",0.0,0.0,
13750,"Titusville, FL: Space Florida Launch Landing Facility",0.0,0.0,
13751,"Nelson, New Zealand: Nelson Airport",0.0,0.0,
13752,"Scone, Australia: Scone Airport",0.0,0.0,
13753,"Nakhon Si Thammarat, Thailand: Nakhon Si Thammarat Airport",0.0,0.0,
13754,"Sigonella, Italy: Sigonella Airport",0.0,0.0,
13755,"Snap Lake, Canada: Snap Lake Mine/Debeers",0.0,0.0,
13756,"Port Hueneme, CA: Point Mugu NAS",0.0,0.0,
13757,"Nantes, France: Nantes Atlantique",0.0,0.0,
13758,"Newcastle, Australia: Williamtown",0.0,0.0,
13759,"Normanton, Australia: Normanton Airport",0.0,0.0,
13760,"Santo Antao, Cape Verde: Santo Antao Airport",0.0,0.0,
13761,"Wajima, Japan: Noto",0.0,0.0,
13762,"Monterrey, Mexico: Del Norte International",0.0,0.0,
13763,"Oceana, VA: Oceana NAS",0.0,0.0,
13764,"Sun City, South Africa: Pilanesberg International",0.0,0.0,
13765,"Nuremberg, Germany: Nuernberg",0.0,0.0,
13766,"Nuguria, Papua New Guinea: Nuguria Airport",0.0,0.0,
13767,"Nuiqsut, AK: Nuiqsut Airport",84.0,219.0,AK
13768,"Nulato, AK: Nulato Airport",44.0,96.0,AK
13769,"Pensacola, FL: Saufley Field NOLF",0.0,0.0,
13770,"Nunapitchuk, AK: Nunapitchuk Airport",87.0,102.0,AK
13771,"Mountain View, CA: Moffett Federal Airfield",0.0,0.0,
13772,"Whidbey Island, WA: Whidbey Island NAS",0.0,0.0,
13773,"Overton, NV: Perkins Field",0.0,0.0,
13774,"Neiva, Colombia: Benito Salas",0.0,0.0,
13775,"Nevada, MO: Nevada Municipal",0.0,0.0,
13776,"Narvik, Norway: Narvik Airport",0.0,0.0,
13777,"Navegantes, Brazil: Ministro Victor Konder International",0.0,0.0,
13778,"Norwich, United Kingdom: Norwich Airport",0.0,0.0,
13780,"Willow Grove, PA: Willow Grove NAS JRB",0.0,0.0,
13781,"Kingston, NY: Kingston Ulster",0.0,0.0,
13782,"Fulton, NY: Oswego County",0.0,0.0,
13783,"Oneonta, NY: F and F Airpark Inc",0.0,0.0,
13784,"New York, NY: New York City Metropolitan Area",0.0,0.0,
13785,"Yuma, AZ: Yuma MCAS/Yuma International",0.0,0.0,
13786,"Nykoping, Sweden: Skavsta",0.0,0.0,
13787,"Nyaung-U, Burma: Bagan",0.0,0.0,
13788,"Jacksonville, FL: Cecil",0.0,0.0,
13789,"Santa Ana, CA: El Toro MCAS",0.0,0.0,
13790,"South Weymouth, MA: South Weymouth NAS",0.0,0.0,
13791,"San Diego, CA: North Island NAS",0.0,0.0,
13792,"Redding, CA: Benton Field",0.0,0.0,
13793,"Orange, Australia: Orange Airport",0.0,0.0,
13794,"Bagram, Afghanistan: Bagram Airport",0.0,0.0,
13795,"Jacksonville/Camp Lejeune, NC: Albert J Ellis",120.0,5497.0,NC
13796,"Oakland, CA: Metro Oakland International",1890.0,122119.0,CA
13797,"Oamaru, New Zealand: Oamaru Airport",0.0,0.0,
13798,"Olanchito, Honduras: El Arrayan",0.0,0.0,
13799,"Oaxaca, Mexico: Oaxaca International",0.0,0.0,
13801,"Obock, Djibouti: Obock Airport",0.0,0.0,
13802,"Oberpfaffenhofen, Germany: Oberpfaffenhofen Airport",0.0,0.0,
13803,"Obihiro, Japan: Obihiro Airport",0.0,0.0,
13804,"Aubenas, France: Aubenas Airport",0.0,0.0,
13805,"Oakland, MD: Garrett County",0.0,0.0,
13806,"Kobuk, AK: Kobuk Airport",28.0,28.0,AK
13808,"Ocean City, MD: Ocean City Municipal",0.0,0.0,
13809,"Ocala, FL: Ocala International-Jim Taylor Field",0.0,0.0,
13810,"Nacogdoches, TX: Nacogdoches A L Mangham Jr Regional",0.0,0.0,
13811,"Oceanic, AK: Thumb Bay",0.0,0.0,
13812,"Ocho Rios, Jamaica: Boscobel",0.0,0.0,
13813,"Oceanside, CA: Bob Maxwell Memorial Airfield",0.0,0.0,
13814,"Washington, NC: Washington Warren",0.0,0.0,
13815,"Ouadda, Central African Republic: Ouadda Airport",0.0,0.0,
13816,"Cordoba, Spain: Cordoba Airport",0.0,0.0,
13817,"Oodnadatta, Australia: Oodnadatta Airport",0.0,0.0,
13818,"Odense, Denmark: Hans Christian Anderson",0.0,0.0,
13819,"Oakland, MD: Oakland Airport",0.0,0.0,
13820,"Odessa, Ukraine: Odessa International",0.0,0.0,
13821,"Oak Harbor, WA: A.J. Eisenberg",0.0,0.0,
13822,"Oecusse, Timor-Leste: Oecusse Airport",0.0,0.0,
13823,"Oernskoeldsvik, Sweden: Ornskoldsvik",0.0,0.0,
13824,"Omaha, NE: Offutt AFB",0.0,0.0,
13825,"Norfolk, NE: Norfolk Regional/Karl Stefan Memorial Field",0.0,0.0,
13826,"Ofu, TT: Ofu Airport",0.0,0.0,
13827,"Ogallala, NE: Searle Field",0.0,0.0,
13828,"Orangeburg, SC: Orangeburg Municipal",0.0,0.0,
13829,"Ogden, UT: Ogden-Hinckley",8.0,684.0,UT
13830,"Kahului, HI: Kahului Airport",815.0,24014.0,HI
13831,"Yonaguni, Japan: Yonaguni Airport",0.0,0.0,
13832,"Ogdensburg, NY: Ogdensburg International",33.0,208.0,NY
13833,"Washington Court House, OH: Fayette County",0.0,0.0,
13834,"Bellefontaine, OH: Bellefontaine Regional",0.0,0.0,
13835,"Chillicothe, OH: Ross County",0.0,0.0,
13836,"Marysville, OH: Union County",0.0,0.0,
13837,"Cincinnati, OH: Cincinnati - Blue Ash",0.0,0.0,
13838,"Ravenna, OH: Portage County",0.0,0.0,
13839,"Kent, OH: Kent State University",0.0,0.0,
13840,"Ohakea, New Zealand: Ohakea Airport",0.0,0.0,
13841,"Northeast Cape, AK: Northeast Cape AFS",0.0,0.0,
13842,"Ohrid, Macedonia: Ohrid Airport",0.0,0.0,
13843,"Oshakati, Namibia: Oshakati Airport",0.0,0.0,
13844,"Wyk Auf Fohr, Germany: Wyk Auf Foehr",0.0,0.0,
13845,"Norwich, NY: Eaton",0.0,0.0,
13846,"Oshima Islands, Japan: Oshima",0.0,0.0,
13847,"Oita, Japan: Oita Airport",0.0,0.0,
13848,"Olathe, KS: Johnson County Executive",0.0,0.0,
13850,"Okinawa, Japan: Naha",0.0,0.0,
13851,"Oklahoma City, OK: Will Rogers World",874.0,56268.0,OK
13852,"Sapporo, Japan: Okadama",0.0,0.0,
13853,"Okayama, Japan: Okayama Airport",0.0,0.0,
13854,"Kokomo/Logansport/Peru, IN: Kokomo Municipal",0.0,0.0,
13855,"Okondja, Gabon: Okondja Airport",0.0,0.0,
13856,"Tokyo, Japan: Yokota AB",0.0,0.0,
13857,"Yorke Island, Australia: Yorke Island Airport",0.0,0.0,
13858,"Oakey, Australia: Oakey Airport",0.0,0.0,
13859,"Orland, Norway: Orland Airport",0.0,0.0,
13860,"Olbia, Italy: Olbia Costa Smeralda",0.0,0.0,
13861,"Olean, NY: Cattaraugus County-Olean",0.0,0.0,
13862,"Wolf Point, MT: L. M. Clayton",61.0,258.0,MT
13863,"Old Harbor, AK: Old Harbor Airport",68.0,98.0,AK
13864,"Olafsvik, Iceland: Rif",0.0,0.0,
13865,"Olympia, WA: Olympia Regional",0.0,0.0,
13866,"Olomouc, Czech Republic: Olomouc Airport",0.0,0.0,
13867,"Olympic Dam, Australia: Olympic Dam Airport",0.0,0.0,
13868,"Nogales, AZ: Nogales International",0.0,0.0,
13869,"Columbus, NE: Columbus Municipal",0.0,0.0,
13870,"Olive Branch, MS: Olive Branch Taylor Field",0.0,0.0,
13871,"Omaha, NE: Eppley Airfield",913.0,53013.0,NE
13872,"Omboue, Gabon: Omboue Airport",0.0,0.0,
13873,"Nome, AK: Nome Airport",414.0,1843.0,AK
13874,"Urmieh, Iran: Uromiyeh",0.0,0.0,
13876,"Omak, WA: Omak Airport",0.0,0.0,
13877,"Omkalai, Papua New Guinea: Omkalai Airport",0.0,0.0,
13878,"Mostar, Bosnia and Herzegovina: Mostar Airport",0.0,0.0,
13879,"Oradea, Romania: Oradea Airport",0.0,0.0,
13880,"Omsk, Russia: Omsk Tsentralny",0.0,0.0,
13881,"Winona, MN: Winona Municipal/Max Conrad Field",0.0,0.0,
13882,"Ondangwa, Namibia: Ondangwa Airport",0.0,0.0,
13883,"Mornington Island, Australia: Mornington Island Airport",0.0,0.0,
13884,"Oneonta, NY: Albert S Nader Regional",0.0,0.0,
13885,"Odate Noshiro, Japan: Odate Noshiro Airport",0.0,0.0,
13886,"O'Neill, NE: The O'Neill Municipal-John L. Baker Field",0.0,0.0,
13887,"Socorro, NM: Socorro Municipal",0.0,0.0,
13888,"Onion Bay, AK: Onion Bay Airport",0.0,0.0,
13889,"Ontario, OR: Ontario Municipal",0.0,0.0,
13890,"Newport, OR: Newport Municipal",0.0,0.0,
13891,"Ontario, CA: Ontario International",1010.0,70361.0,CA
13892,"Colon, Panama: Enrique A Jimenez",0.0,0.0,
13893,"Cobol, AK: Cobol Alaska/Scaled/",0.0,0.0,
13894,"Toksook, AK: Toksook Bay",154.0,225.0,AK
13895,"Gold Coast, Australia: Gold Coast Airport",0.0,0.0,
13896,"Cooma, Australia: Cooma Airport",0.0,0.0,
13898,"Miami, FL: Miami Opa Locka Executive",0.0,0.0,
13899,"Ophir, AK: Ophir Airport",0.0,0.0,
13900,"Porto, Portugal: Porto Airport",0.0,0.0,
13901,"McDonald Lake, AK: McDonald Lake Airport",0.0,0.0,
13902,"Bible Camp, AK: Bible Camp Airport",0.0,0.0,
13903,"Cinder River Lodge, AK: Cinder River Lodge Airport",0.0,0.0,
13905,"Lemesurier Island, AK: Lemesurier Island Airport",0.0,0.0,
13906,"Tracy Arm, AK: Tracy Arm Airport",0.0,0.0,
13908,"Vrems, AK: Vrems Airport",0.0,0.0,
13909,"Akolik, AK: Akolik Airport",0.0,0.0,
13910,"Mels, AK: Mels Airport",0.0,0.0,
13911,"Meshik, AK: Meshik Airport",0.0,0.0,
13912,"Telaquana Lake, AK: Telaquana Lake Airport",0.0,0.0,
13913,"Chelatna Lake Lodge, AK: Chelatna Lake Lodge Airport",0.0,0.0,
13914,"Pumice, AK: Pumice Airport",0.0,0.0,
13915,"Port Alsworth, AK: Points Alsworth",0.0,0.0,
13916,"Twin Lakes, AK: Twin Lakes Airport",0.0,0.0,
13917,"Sandy, AK: Sandy Airport",0.0,0.0,
13919,"Waterkloof, South Africa: Waterkloof AFB",0.0,0.0,
13920,"Shirleyville, AK: Shirleyville Airport",0.0,0.0,
13921,"Doug Carney Strip, AK: Doug Carney Strip Airport",0.0,0.0,
13922,"Shisholik, AK: Shisholik Airport",0.0,0.0,
13923,"Sivinuvik, AK: Camp Sivinuvik",0.0,0.0,
13924,"American Creek, AK: American Creek Airport",0.0,0.0,
13925,"Grants Pass, OR: Grants Pass Airport",0.0,0.0,
13926,"Gleneden, OR: Siletz Bay State",0.0,0.0,
13927,"Florence, OR: Florence Municipal",0.0,0.0,
13928,"Orebro, Sweden: Orebro Airport",0.0,0.0,
13929,"Orocue, Colombia: Orocue Airport",0.0,0.0,
13930,"Chicago, IL: Chicago O'Hare International",9034.0,533658.0,IL
13931,"Norfolk, VA: Norfolk International",757.0,46415.0,VA
13932,"Paramaribo, Suriname: Zorg en Hoop",0.0,0.0,
13933,"Worcester, MA: Worcester Regional",37.0,294.0,MA
13934,"Port Lions, AK: Port Lions Airport",57.0,61.0,AK
13935,"Cork, Ireland: Cork Airport",0.0,0.0,
13936,"Orlando, FL: Executive",0.0,0.0,
13937,"Oran, Algeria: Ahmed Benbella",0.0,0.0,
13939,"Orapa, Botswana: Orapa Airport",0.0,0.0,
13940,"Northway, AK: Northway Airport",0.0,0.0,
13941,"Oruro, Bolivia: Juan Mendoza",0.0,0.0,
13942,"Noorvik, AK: Robert/Bob/Curtis Memorial",61.0,111.0,AK
13943,"Paris, France: Orly",0.0,0.0,
13944,"Orange Walk, Belize: Orange Walk Airport",0.0,0.0,
13945,"Osaka, Japan: Osaka Metropolitan Area",0.0,0.0,
13946,"Osage Beach, MO: Grand Glaize - Osage Beach",0.0,0.0,
13947,"Oscoda, MI: Oscoda-Wurtsmith",0.0,0.0,
13948,"Ostersund, Sweden: Are Ostersund",0.0,0.0,
13949,"Oshkosh, WI: Wittman Regional",0.0,0.0,
13950,"Osijek, Croatia: Osijek Airport",0.0,0.0,
13951,"Oskarshamn, Sweden: Oskarshamn Airport",0.0,0.0,
